{"id":"EXP-042","name":"live-linkedin-validation-and-location-fix","timestamp":"2026-03-31T16:04:00Z","skill":"job-scraping","metric":"location_normalization","hypothesis":"LinkedIn location normalization fails for standalone 대한민국 (no comma prefix), and live LinkedIn selectors need validation against real data","change":"Fixed location regex: /,?\\s*대한민국/ (made comma optional). Added authwall detection guidance to SKILL.md v3.8. Created test_live_linkedin.js with 14 tests using real scraped LinkedIn data.","baseline":{"linkedin_live_tests":"0","standalone_대한민국":"NOT STRIPPED","authwall_guidance":"none"},"result":{"linkedin_live_tests":"14/14 (100%)","standalone_대한민국":"STRIPPED","authwall_guidance":"documented","all_existing_tests":"PASS","regressions":0},"delta":"+14 live LinkedIn tests, 1 location bug fixed, authwall detection added","verdict":"keep","improvement_description":"Live LinkedIn scraping validated against real data from April 2026. Found and fixed location normalization bug: standalone 대한민국 (without comma) was not stripped, causing noisy location data for jobs with location='대한민국' only. Made comma optional in regex. Added authwall detection guidance for intermittent LinkedIn login redirects. All 14 new tests pass with 0 regressions."}
{"id":"EXP-044","name":"resume-match-pipeline-integration","timestamp":"2026-04-01T18:04:00Z","skill":"resume-matching","metric":"pipeline_integration","hypothesis":"Creating integration tests between resume-agent output and matching algorithm input catches schema mismatches and prevents regressions","change":"Created test_resume_match_integration.js with 52 tests covering 9 integration areas: skill extraction, experience scoring, career stage, preferences, culture, domain alignment, full pipeline, schema completeness, edge cases. Updated resume-agent.md.","baseline":{"integration_tests":"0","pipeline_verified":false},"expected_improvement":"Full pipeline verification with zero-gap confidence","result":{"integration_tests":"52/52 (100%)","pipeline_verified":true,"discrimination_gap":"20+","total_tests":"164+","regressions":0},"delta":"+52 integration tests, 0 regressions","verdict":"keep","improvement_description":"First integration test suite connecting resume-agent master.yaml output to matching algorithm input. 52 tests verify data flows correctly across 9 areas: skills, experience, career stage, preferences, culture, domain alignment, full scoring, schema completeness, and edge cases. No schema gaps found — the pipeline is clean."}
{"id":"EXP-045","name":"cross-source-deduplication","timestamp":"2026-04-01T19:04:00Z","skill":"job-scraping","metric":"cross_source_duplicate_detection","hypothesis":"Same job posted on Wanted, JobKorea, LinkedIn has different URLs — fuzzy title+company matching with Korean↔English equivalents detects cross-source duplicates","change":"Created test_cross_source_dedup.js with 13 test cases. Implemented normalize/titleSimilarity/companyMatch/isDuplicate/findDuplicates with Korean↔English token equivalents. Updated SKILL.md v4.0 with dedup section. Updated scraper-agent.md.","baseline":{"cross_source_dedup_tests":"0","ko_en_equivalents":"0"},"expected_improvement":"Detect cross-source duplicates via fuzzy matching","result":{"cross_source_dedup_tests":"13/13 (100%)","ko_en_equivalents":12,"false_positive_tests":"4/4","false_negative_tests":"0","all_existing_tests":"PASS","regressions":0},"delta":"+13 tests, +12 ko↔en equivalents, 0 regressions","verdict":"keep","improvement_description":"Cross-source deduplication detects same job across Wanted/JobKorea/LinkedIn using fuzzy title+company matching. Korean↔English title equivalents bridge language gaps (프론트엔드↔frontend). False positive prevention ensures different jobs at same company are not flagged."}
{"id":"EXP-046","name":"jobkorea-salary-extraction","timestamp":"2026-03-31T20:04:00Z","skill":"job-scraping","metric":"salary_field_extraction","hypothesis":"Adding salary line classification to JobKorea positional parsing populates the previously-empty salary field for JobKorea-sourced jobs","change":"Added salary classifier (연봉/월급 patterns + 면접후결정) to JobKorea line classification. Added 4 new salary test cases (annual range, monthly range, single value, negotiable). Updated SKILL.md v4.1 with salary extraction in inline JS.","baseline":{"jobkorea_tests":"11/11","salary_extracted":"no","salary_test_cases":0},"expected_improvement":"Salary field populated for JobKorea jobs","result":{"jobkorea_tests":"15/15","salary_extracted":"yes","salary_test_cases":"4/4","salary_patterns":"annual+monthly+single+negotiable","all_existing_tests":"PASS","regressions":0},"delta":"+4 tests, salary extraction from 0 to full coverage, 0 regressions","verdict":"keep","improvement_description":"JobKorea salary extraction added to positional line parser. Cards with 연봉 5000~8000만원, 월급 300~500만원, 연봉 6000만원 이상, or 면접후결정 now correctly populate the salary field. Previously salary was always empty for JobKorea-sourced jobs despite the DB schema supporting it since EXP-027."}
{"id":"EXP-049","name":"framework-aware-domain-detection","timestamp":"2026-04-01T23:04:00Z","skill":"job-matching","metric":"domain_alignment_coverage","hypothesis":"Extending PRIMARY_DOMAINS to map frameworks (Spring, Django, React, Express, etc.) to their parent language domain catches cross-domain mismatches in framework-only job listings that previously escaped penalty","change":"Added 15 framework→domain mappings to PRIMARY_DOMAINS (Spring→java, Django→python, React→js/ts, Express→js/ts, Flutter→dart, Laravel→php, Rails→ruby, etc.). Added Kotlin→java mapping. Added 6 test cases for framework-only domain detection. Updated SKILL.md and matcher-agent.md.","baseline":{"domain_entries":9,"framework_aware":false,"test_count":27},"expected_improvement":"Framework-only job listings now trigger domain alignment penalty correctly","result":{"domain_entries":24,"framework_aware":true,"test_count":33,"new_framework_tests":"6/6","all_tests":"PASS","regressions":0},"delta":"+15 domain entries, +6 tests, 0 regressions","verdict":"keep","improvement_description":"Framework-aware domain detection closes a real gap: job listings that only mention frameworks (Spring, Django, React) without raw language keywords now correctly trigger the 40% domain alignment penalty. Previously a [Spring, MySQL] job for a JS/React candidate would escape the penalty because 'Spring' wasn't mapped to any domain. Now 24 entries cover 12 language domains including frameworks."}
{"id":"EXP-050","name":"nlp-parser-v3-bugfixes-new-filters","timestamp":"2026-04-01T01:04:00Z","skill":"job-tracking","metric":"nlp_parser_correctness","hypothesis":"NLP parser v2 had 3 bugs (missing SQL quote, company substring conflict, 최신순 keyword spill) and lacked 5 documented filter features (salary, experience, deadline urgency, deadline sorting, N일 남은)","change":"Rewrote parser in test_korean_nlp_v3.js: (1) Fixed SQL quote bug in keyword LIKE filter, (2) Sort companies by length DESC to match longest first, (3) Consume sorting keywords early to prevent keyword spill, (4) Added salary filter (연봉/급여/연수입), (5) Added deadline urgency (마감임박/곧마감/오늘 마감/내일 마감/N일 남은/기한 있는), (6) Added 마감순 sorting. Updated SKILL.md v2.2 and tracker-agent.md v3.","baseline":{"nlp_v2_tests":"18/18","bugs":3,"missing_features":5},"result":{"nlp_v3_tests":"30/30","bugs_fixed":3,"new_features":5,"all_existing_tests":"PASS","regressions":0},"delta":"3 bugs fixed, 5 new filter features, +12 test cases, 0 regressions","verdict":"keep","improvement_description":"NLP parser v3 fixes 3 bugs: (1) unbalanced SQL quotes in keyword LIKE filter would cause SQL errors at runtime, (2) 카카오뱅크 queries incorrectly matched 카카오 too (company substring conflict), (3) 최신순 was treated as a title keyword instead of sort order. Added 5 new filter features documented in SKILL.md but missing from implementation: salary, deadline urgency (마감임박/곧마감/오늘/내일/N일 남은), deadline sorting (마감순). 30 tests total with 0 regressions."}
{"id":"EXP-052","name":"title-based-skill-inference","timestamp":"2026-04-01T04:04:00Z","skill":"job-matching","metric":"empty_skills_discrimination","hypothesis":"Extracting explicit technology keywords from job titles when skills list is empty restores correct matching discrimination for partially-scraped jobs","change":"Added inferSkillsFromTitle() with 30+ tech patterns (English+Korean). Supplements explicit skills when job.skills.length < 2. Updated SKILL.md v3.3 and matcher-agent.md v4.2.","baseline":{"empty_skills_score":"50 (neutral)","discrimination_gap":"0","title_inference_tests":"0"},"result":{"title_inference_tests":"33/33 (100%)","discrimination_gap":"82 points","react_title_score":84,"java_title_score":2,"all_existing_tests":"PASS","regressions":0},"delta":"+33 new tests, 0 regressions, discrimination restored for empty-skills jobs","verdict":"keep","improvement_description":"Title-based skill inference fixes the blind spot where partially-scraped jobs (empty skills) all scored ~50 regardless of actual tech domain. A React/TypeScript job now scores 84 and a Java/Spring job scores 2 for a JS candidate — 82pt discrimination gap vs 0 before. Only extracts explicit tech mentions (not role names), so no false inferences from titles like 프론트엔드 or 백엔드."}
{"id":"EXP-056","name":"nlp-yearsof-experience-patterns","timestamp":"2026-04-01T10:04:00Z","skill":"job-tracking","metric":"nlp_experience_coverage","hypothesis":"Adding N년차 pattern and standalone 경력 filter to NLP parser enables natural Korean experience-level queries without keyword leak","change":"Added N년차 regex pattern, standalone 경력 filter (excludes 신입-only), added 년차 to stopWords to prevent keyword leak. 4 new test cases: 5년차, 3년차+관심, 경력 standalone, 경력 5년 이상+서울. Updated SKILL.md v2.4 and tracker-agent.md v3.2.","baseline":{"nlp_v3_tests":"35/35","년차_stopword":"missing","standalone_경력":"not supported"},"expected_improvement":"Natural Korean experience queries without keyword pollution","result":{"nlp_v3_tests":"39/39 (100%)","new_patterns":2,"new_tests":"4/4","년차_leak":"fixed","standalone_경력":"working","all_existing_tests":"PASS","regressions":0},"delta":"+4 tests, +2 NLP patterns, 1 keyword leak fixed, 0 regressions","verdict":"keep","improvement_description":"NLP parser now handles N년차 (e.g., 5년차) and standalone 경력 queries. Previously 5년차 would leak 년차 into title/company keyword search. Now 년차 is properly consumed as a stopword. Standalone 경력 correctly filters out 신입-only jobs. Users can query naturally: 5년차 공고 있어?, 경력 공고, 경력 3년 이상 서울."}
{"id":"EXP-057","name":"wanted-salary-extraction","timestamp":"2026-04-01T11:04:00Z","skill":"job-scraping","metric":"salary_field_extraction","hypothesis":"Adding standalone 면접후결정 capture and salary test cases for Wanted post-processor fixes title pollution and closes the salary test gap","change":"Added standalone 면접후결정 salary capture (not preceded by 연봉/월급) in post-process-wanted.js. Added 5 salary test cases covering range, single value, standalone negotiable, prefix negotiable, and no-title-leak. Updated SKILL.md v4.4.","baseline":{"post_process_tests":"15/15","salary_tests":"0","standalone_면접후결정":"leaked to title"},"expected_improvement":"Salary extracted for all Wanted patterns including standalone 면접후결정; no title pollution","result":{"post_process_tests":"20/20 (100%)","salary_tests":"5/5","standalone_면접후결정":"captured as salary","salary_no_title_leak":true,"all_existing_tests":"PASS","regressions":0},"delta":"+5 tests, 1 bug fixed (면접후결정 title pollution), 0 regressions","verdict":"keep","improvement_description":"Fixed standalone 면접후결정 leaking into job title instead of being captured as salary. Added 5 salary test cases for Wanted covering 연봉 ranges, single values, standalone negotiable, prefix negotiable, and title pollution prevention. Closes the Wanted salary test gap — JobKorea had salary tests since EXP-046 but Wanted had zero."}
{"id":"EXP-063","name":"culture-extraction-postprocessor","timestamp":"2026-04-01T17:04:00Z","skill":"job-scraping+job-matching","metric":"culture_weight_activation","hypothesis":"Adding culture keyword extraction to post-process-wanted.js activates the 15% culture weight in matching for real scraped jobs; fixing default score inconsistency (50 vs 70)","change":"Added extractCultureKeywords() with 7 culture categories to post-process-wanted.js. parseWantedJob now outputs culture_keywords array. Fixed default score in test_culture_extraction.js from 70 to 50. Updated SKILL.md v4.7, scraper-agent.md.","baseline":{"culture_in_postprocessor":false,"default_score_consistency":"50 vs 70 mismatch","total_tests":590},"expected_improvement":"15% culture weight functional for real scraped jobs; consistent scoring across test suites","result":{"culture_postprocess_tests":"16/16","culture_categories":7,"default_score":"50 (aligned)","total_tests":"606","regressions":0},"delta":"+16 tests, +1 test suite, culture weight activated, score inconsistency fixed","verdict":"keep","improvement_description":"Culture keyword extraction added to post-processor with 7 categories (innovative, collaborative, fast_paced, structured, learning_focused, autonomous, work_life_balance). Even short card text now triggers detection. Default culture score aligned to 50 across all test files. The 15% culture weight is now functional for real scraped data."}
{"id":"EXP-064","name":"detail-skill-similarity-map-expansion","timestamp":"2026-04-01T18:04:00Z","skill":"job-matching","metric":"similarity_coverage","hypothesis":"Extending similarity map with pairs for detail-extracted skills (GraphQL↔REST API, Jenkins↔GitHub Actions, Kafka↔RabbitMQ, TensorFlow↔PyTorch, Elasticsearch↔Redis, etc.) improves matching accuracy for real scraped jobs","change":"Added 11 new similarity pairs across 3 tiers: Tier1 aliases (k8s↔kubernetes, spring_boot↔spring boot), Tier2 strong (GraphQL↔REST API, Jenkins↔GitHub Actions, Terraform↔Ansible, Kafka↔RabbitMQ, TensorFlow↔PyTorch, Elasticsearch↔Redis, Oracle↔MSSQL), Tier3 partial (Docker↔Terraform, Nginx↔Docker, Spark↔Hadoop, Pandas↔Spark, GraphQL↔gRPC, MongoDB↔Redis). Updated SKILL.md, matcher-agent.md. Fixed duplicate JS object key issue (spark, docker appeared in multiple tier entries).","baseline":{"similarity_pairs":"~15","detail_skill_coverage":"0%","total_tests":"606"},"expected_improvement":"Detail-extracted skills now have meaningful similarity scores instead of zero","result":{"similarity_pairs":"40+","new_detail_skill_pairs":"11","total_tests":"616","all_passing":true,"discrimination":"PASS","regressions":0},"delta":"+11 similarity pairs, +10 tests, 0 regressions","verdict":"keep","improvement_description":"Similarity map expanded to cover the 50+ skills extracted by detail-page skill extraction (EXP-059). Previously, extracted skills like GraphQL, Jenkins, Kafka, TensorFlow had zero similarity to any other skill — real scraped jobs with these skills would get artificially low matching scores even when the candidate had closely related skills. 11 new pairs bridge the gap: GraphQL↔REST API (API paradigms), Jenkins↔GitHub Actions (CI/CD), Kafka↔RabbitMQ (message queues), TensorFlow↔PyTorch (ML), Elasticsearch↔Redis (real-time data), and more. Fixed JS object key collision bug where duplicate keys (spark, docker) in tier maps silently overwrote entries."}
{"id":"EXP-067","name":"korean-english-company-equivalents-dedup","timestamp":"2026-04-01T21:04:00Z","skill":"job-scraping","metric":"cross_source_company_matching","hypothesis":"LinkedIn uses English company names while Korean sources use Korean names. Adding Korean↔English company equivalence map enables cross-source dedup between LinkedIn and Korean sources","change":"Added companyKoEnMap with 25 Korean↔English company equivalents. Added companyToCanonical() function. Expanded title equivalents with 9 new entries. Added 5 new test cases. Added expectedGroupSize validation. Updated SKILL.md v4.9 and scraper-agent.md.","baseline":{"cross_source_dedup_tests":"13","ko_en_company_equivalents":"0","three_source_group_size":"2 of 3 sources detected"},"result":{"cross_source_dedup_tests":"18/18 (100%)","ko_en_company_equivalents":"25","three_source_group_size":"3 of 3 sources detected","all_tests":"647","regressions":0},"delta":"+5 tests, +25 company equivalents, LinkedIn dedup now functional, 0 regressions","verdict":"keep","improvement_description":"Cross-source dedup now matches Korean↔English company names (카카오↔Kakao, 네이버↔Naver, 라인↔LINE, 토스↔Toss, etc.). Previously LinkedIn entries with English company names were never deduplicated against Korean sources. Also discovered that the existing 3-source test was passing coincidentally — the LINE entry was not actually matched to the 라인 entries. Now all 3 sources correctly join one dedup group."}
{"id":"EXP-068","name":"salary-pipeline-integration","timestamp":"2026-04-01T22:04:00Z","skill":"job-scraping","metric":"salary_field_population","hypothesis":"Salary normalization existed in test_salary_normalization.js but was never wired into production post-process-wanted.js. salary_min/salary_max were always null in parsed output, making NLP salary queries non-functional against real data.","change":"Added normalizeSalary() to post-process-wanted.js. Added 억 pattern to salary capture regex. Populates salary_min/salary_max on every parsed job. Created test_salary_pipeline.js with 12 tests (6 unit + 6 integration). Updated SKILL.md, scraper-agent.md.","baseline":{"salary_min_max_populated":false,"salary_pipeline_tests":"0","억_capture":false},"result":{"salary_min_max_populated":true,"salary_pipeline_tests":"12/12 (100%)","억_capture":true,"total_tests":"659","regressions":0},"delta":"+12 tests, salary pipeline functional, 억 capture added, 0 regressions","verdict":"keep","improvement_description":"Salary normalization integrated into production post-processor. Previously salary_min/salary_max were always null — the DB columns existed since EXP-027 but were never populated by the parsing pipeline. Now 연봉 5000~8000만원 → salary_min:5000, salary_max:8000; 월급 300~500만원 → 3600/6000 (monthly→annual); 연봉 1~2억 → 10000/20000. NLP salary queries are now functional against real scraped data."}
{"id":"EXP-069","name":"jobkorea-salary-normalization-pipeline","timestamp":"2026-04-01T23:04:00Z","skill":"job-scraping","metric":"salary_field_population","hypothesis":"normalizeSalary() was only wired into post-process-wanted.js. JobKorea-sourced jobs had salary_min/salary_max always null despite salary text being extracted (EXP-046). Creating post-process-jobkorea.js reuses normalizeSalary() for JobKorea cards.","change":"Created post-process-jobkorea.js with parseJobKoreaCard() that extracts all fields via positional parsing then normalizes salary via shared normalizeSalary(). Added post-process step to SKILL.md JobKorea workflow. Updated scraper-agent.md. 12 test cases.","baseline":{"jobkorea_salary_pipeline_tests":"0","salary_min_max_populated":false,"total_tests":659},"expected_improvement":"JobKorea salary_min/salary_max populated; NLP salary queries work for JobKorea-sourced jobs","result":{"jobkorea_salary_pipeline_tests":"12/12 (100%)","salary_min_max_populated":true,"total_tests":"671","all_passing":true,"regressions":0},"delta":"+12 tests, JobKorea salary pipeline functional, 0 regressions","verdict":"keep","improvement_description":"JobKorea salary normalization pipeline created. post-process-jobkorea.js reuses normalizeSalary() from Wanted post-processor. Previously JobKorea-sourced jobs always had null salary_min/salary_max — now 연봉 5000~8000만원 → 5000/8000, 월급 300~500만원 → 3600/6000 (monthly→annual), 연봉 1~2억 → 10000/20000. NLP salary queries (연봉 5000 이상) now work across all sources."}
{"id":"EXP-070","name":"linkedin-post-processor","timestamp":"2026-04-02T00:04:00Z","skill":"job-scraping","metric":"linkedin_pipeline_parity","hypothesis":"LinkedIn had no post-processor unlike Wanted and JobKorea. Raw cards only had title/company/location/link — no experience, skills, salary, or work_type. Creating post-process-linkedin.js with experience level extraction, skill inference, salary normalization, and work_type detection brings LinkedIn to parity","change":"Created scripts/post-process-linkedin.js with parseLinkedInCard(), extractExperienceLevel(), inferSkillsFromText(), extractSalary(), detectWorkType(). Created test_linkedin_postprocess.js with 32 tests. Updated SKILL.md v5.1 and scraper-agent.md.","baseline":{"linkedin_postprocessor":"none","linkedin_enriched_fields":0,"linkedin_tests":"14 (basic only)","linkedin_skills":"none","linkedin_salary":"none","linkedin_experience":"none"},"result":{"linkedin_postprocessor":"full","linkedin_enriched_fields":7,"linkedin_tests":"32/32 (100%) + 14 existing","linkedin_skills":"50+ patterns","linkedin_salary":"full (만원/억/면접후결정)","linkedin_experience":"5 levels (senior/mid/junior/intern/none)","total_tests":"703","regressions":0},"delta":"+32 tests, +1 post-processor, LinkedIn pipeline at parity, 0 regressions","verdict":"keep","improvement_description":"LinkedIn post-processor created, bringing LinkedIn scraping pipeline to parity with Wanted and JobKorea. Previously LinkedIn cards had only raw title/company/location — now they get experience level (senior/mid/junior/intern from title patterns including Korean 신입 and N년차), 50+ skill patterns inferred from title+description (with k8s→kubernetes, golang→go normalization), salary extraction via shared normalizeSalary(), work_type detection, and Korean↔English location normalization. Korean word boundary fix: \\b doesn't work with Korean chars in parentheses, so patterns use context-aware boundary matching instead. 32 new tests, 0 regressions, total 703 tests passing."}
