{"id":"EXP-134","name":"minimum-experience-career-stage","timestamp":"2026-04-05T19:04:00Z","skill":"job-scraping+job-matching","metric":"career_stage_accuracy","hypothesis":"For N년 이상 patterns, deriveCareerStage uses the minimum year directly, making 3년 이상 → junior when it should be mid","change":"Added isMinimum flag for N년 이상 and N년↑ patterns. When true, reference year bumped by +1 before threshold: 3년 이상 → 3+1=4 → mid","baseline":{"3년_이상":"junior","6년_이상":"mid","total_tests":1665},"result":{"3년_이상":"mid","6년_이상":"mid","total_tests":"1665+","regressions":0},"delta":"3년 이상 corrected to mid, +1 bump for minimum patterns, 0 regressions","verdict":"keep","improvement_description":"Career stage for minimum-experience patterns corrected. Jobs requiring 3+ years now correctly map to mid instead of junior, improving the 15% career_stage matching weight by +20 points for mid-level candidates."}
{"id":"EXP-135","name":"nlp-면접후결정-salary-filter-N년차-이상","timestamp":"2026-04-05T20:04:00Z","skill":"job-tracking","metric":"nlp_query_accuracy","hypothesis":"면접후결정 matched interview status regex instead of salary negotiable. N년 이상 regex matched N년차 without negative lookahead, giving wrong career_stage filter","change":"(1) Added negative lookahead (?!후결정) to 면접 status regex. (2) Added 면접후결정 as salary negotiable filter. (3) Added (?!차) to N년 이상 regex to prevent matching N년차. (4) Added N년차 이상 handling to N년차 branch with tighter filtering. (5) Added 면접후결정 to stopWords.","baseline":{"면접후결정":"interview status (wrong)","3년차_이상":"all stages (wrong)","5년차":"all stages inclusive","10년차":"mid+ inclusive","total_tests":1733},"result":{"면접후결정":"salary negotiable filter","3년차_이상":"mid+","5년차":"mid+","10년차":"senior+","total_tests":1748,"new_tests":15,"all_passing":true,"regressions":0},"delta":"2 bugs fixed, +15 tests, 0 regressions","verdict":"keep","improvement_description":"Two NLP parser bugs fixed: (1) 면접후결정 now correctly triggers salary negotiable filter instead of interview status. The regex /면접(잡힌|보는)?/ matched 면접후결정 at the 면접 prefix, adding a.status='interview' filter to queries about negotiable-salary jobs. Fixed with negative lookahead (?!후결정). (2) N년차 이상 now gives tighter career_stage filters. The N년 이상 regex /(\\d+)\\s*년\\s*(이상)?/ matched 3년 from 3년차, bypassing the N년차 branch entirely and returning all career stages for 3년차 이상 queries. Fixed with (?!차) lookahead. N년차 이상 now uses the same tight thresholds as N년 이상 (mid+ for 3-7, senior+ for 8-12)."}
{"id":"EXP-136","name":"korean-alias-false-positive-fix","timestamp":"2026-04-05T21:04:00Z","skill":"job-tracking+job-scraping+job-matching","metric":"nlp_skill_accuracy","hypothesis":"Korean skill aliases 뷰→vue and 다트→dart match as substrings of longer Korean words (뷰티샵, 다트게임), causing false positive skill filters. 삼성 generates redundant company+location filters.","change":"Added Korean word boundary lookahead (?![가-힣]) to 뷰 and 다트 patterns in nlp-parser.js and skill-inference.js. Added company-filter check in location loop to skip 삼성 double-filter.","baseline":{"뷰_false_positive":"뷰티샵→vue","다트_false_positive":"다트게임→dart","삼성_filters":2,"total_tests":"67 files"},"result":{"뷰_false_positive":"fixed","다트_false_positive":"fixed","삼성_filters":1,"new_tests":13,"total_tests":"68 files","regressions":0},"delta":"3 bugs fixed, +13 tests, 0 regressions","verdict":"keep","improvement_description":"Fixed Korean alias false positives for 뷰 and 다트 skill patterns. Previously 뷰티샵 공고 incorrectly filtered for Vue jobs, and 다트게임 공고 filtered for Dart/Flutter jobs. Added Korean word boundary lookahead to prevent matching inside longer Korean words. Also fixed 삼성 generating redundant company+location filters. 13 new test cases covering all fixed patterns."}
{"id":"EXP-138","name":"api-company-name-cleanup","timestamp":"2026-04-05T23:04:00Z","skill":"job-scraping","metric":"company_name_accuracy","hypothesis":"Wanted API returns company names with Korean legal entity prefixes ((주), 주식회사, ㈜) that break dedup, NLP queries, and company matching for API-sourced jobs","change":"Added cleanCompanyName() with 5 prefix patterns to scrape-wanted-api.js. Updated parsePosition() to use it instead of raw pos.company?.name.","baseline":{"company_prefix_stripped":false,"api_company_tests":0,"total_tests":"1748+"},"result":{"company_prefix_stripped":true,"api_company_tests":"17/17","total_tests":"1765+","regressions":0},"delta":"+17 tests, company names cleaned for API path, 0 regressions","verdict":"keep","improvement_description":"Wanted API company names cleaned of Korean legal entity prefixes. Previously (주)카카오 was stored as-is, breaking NLP company queries (카카오 공고), cross-source dedup ((주)카카오 ≠ 카카오 from JobKorea), and company preference matching. ~90% of Wanted API company names have (주) prefix. cleanCompanyName strips (주), 주식회사, ㈜, 유한회사, (유) prefixes."}
{"id":"EXP-139","name":"title-based-career-stage-override","timestamp":"2026-04-06T00:04:00Z","skill":"job-scraping+job-matching","metric":"career_stage_accuracy","hypothesis":"Wanted API returns '경력' for all non-newbie jobs regardless of seniority — title-based career stage detection overrides the generic mid default","change":"Added deriveCareerStageFromTitle() to skill-inference.js with Korean (시니어/주니어/신입) and English (Senior/Lead/Staff/Principal/Junior) patterns. Updated scrape-wanted-api.js to prefer title-based over experience-based career stage.","baseline":{"시니어_프론트엔드":"mid","lead_engineer":"mid","career_stage_from_title":"not supported","total_tests":72},"result":{"시니어_프론트엔드":"senior","lead_engineer":"lead","career_stage_from_title":"6 patterns","total_tests":73,"regressions":0},"delta":"+28 tests, title-based career stage functional, 0 regressions","verdict":"keep","improvement_description":"Title-based career stage detection fixes the gap where Wanted API's generic '경력' experience value produced mid for all non-newbie jobs. 시니어 프론트엔드 개발자 now correctly returns senior, Frontend Engineer Lead returns lead. Korean (시니어/주니어/신입) and English (Senior/Sr./Lead/Staff/Principal/Junior/Jr.) patterns supported. Falls back to experience-based deriveCareerStage when title has no seniority indicator."}
{"id":"EXP-141","name":"frontend-hyphen-skill-inference","timestamp":"2026-04-06T03:04:00Z","skill":"job-scraping+job-matching","metric":"skill_extraction_accuracy","hypothesis":"English role titles with hyphens (Front-end Engineer) return empty skills because ROLE_SKILL_MAP only has 'frontend' without hyphen","change":"Added 'front-end' and 'front end' to ROLE_SKILL_MAP in skill-inference.js. 13 new test cases.","baseline":{"front_end_skills":"[]","live_api_zero_skill_rate":"2/12","total_tests":"1765+"},"result":{"front_end_skills":"['react','typescript','javascript']","live_api_zero_skill_rate":"1/12","total_tests":"1778+","new_tests":13,"regressions":0},"delta":"+13 tests, front-end skill extraction fixed, 0 regressions","verdict":"keep","improvement_description":"Hyphenated English role title 'Front-end Engineer' now correctly returns react+typescript+javascript from ROLE_SKILL_MAP. Found via live Wanted API scraping where [hourplace] Front-end Engineer had empty skills. Only front-end was missing — back-end and full-stack already had hyphenated entries."}
{"id":"EXP-143","name":"role-skill-map-coverage-expansion","timestamp":"2026-04-06T06:04:00Z","skill":"job-scraping+job-matching","metric":"role_skill_coverage","hypothesis":"Common English role titles (System/Network Engineer, DBA, Solution Architect) and Korean 데이터 애널리스트 had no ROLE_SKILL_MAP entries; MLOps only returned mlops without infra skills","change":"Added 7 English role titles + 1 Korean form to ROLE_SKILL_MAP. MLOps now includes docker+kubernetes+python. Added 5 non-technical role entries returning empty.","baseline":{"system_engineer_skills":"[]","network_engineer_skills":"[]","dba_skills":"[]","solution_architect_skills":"[]","mlops_engineer_skills":"[mlops]","데이터_애널리스트":"[]","total_tests":"1778+"},"result":{"system_engineer_skills":"[linux,docker,kubernetes]","network_engineer_skills":"[linux,docker,kubernetes]","dba_skills":"[postgresql,mysql,redis,linux]","solution_architect_skills":"[aws,docker,kubernetes]","mlops_engineer_skills":"[mlops,docker,kubernetes,python]","데이터_애널리스트":"[python,sql]","new_tests":18,"regressions":0},"delta":"+18 tests, +8 role mappings, 0 regressions","verdict":"keep","improvement_description":"English role titles common in Korean job market now return meaningful skills. System/Network Engineer, DBA, Solution Architect were completely invisible to the 35% skill matching weight. MLOps now includes infrastructure skills. Non-technical roles explicitly return empty to prevent false positives."}
{"id":"EXP-144","name":"korean-lead-career-stage","timestamp":"2026-04-06T07:04:00Z","skill":"job-scraping+job-matching","metric":"career_stage_accuracy","hypothesis":"deriveCareerStageFromTitle only checked English 'lead' but not Korean 리드/리더, causing Korean-titled lead positions (프론트엔드 개발 리드) to get career_stage=mid instead of lead","change":"Added Korean 리드/리더 pattern with word boundary to prevent false positives (칠리드레스). Added 10 new test cases (8 positive + 2 negative). Updated scraper-agent.md.","baseline":{"리드_career_stage":"mid","리더_career_stage":"mid","total_tests":"~1786"},"result":{"리드_career_stage":"lead","리더_career_stage":"lead","칠리드레스_false_positive":"null (correct)","total_tests":"~1796","new_tests":10,"regressions":0},"delta":"+10 tests, Korean 리드/리더→lead, false positive prevented, 0 regressions","verdict":"keep","improvement_description":"Korean 리드/리더 in job titles now correctly maps to career_stage=lead. Previously '프론트엔드 개발 리드' got career_stage=mid (fallback from generic 경력), same as a regular mid-level developer. The 15% career_stage matching weight couldn't differentiate. Korean NLP queries for 리드 포지션 would miss these jobs. False positive prevention: 칠리드레스 contains 리드 substring but is not a seniority indicator — word boundary regex prevents matching inside longer Korean words."}
{"id":"EXP-145","name":"employment-negation-mlops-korean-roles-stopwords","timestamp":"2026-04-06T10:00:00Z","skill":"job-tracking+job-scraping+job-matching","metric":"nlp_query_accuracy","hypothesis":"Employment type negation, MLOps regex variants, Korean role skill inference in NLP, expanded stopWords","change":"Added 뺀 negation, employment type negation support, MLOps regex variants (ML/Ops, ML Ops), NLP role-based skill inference (풀스택/프론트엔드/백엔드/안드로이드/프론트), 50+ new stopWords","baseline":{"employment_negation":"not supported","mlops_variants":"mlops only","role_nlp_inference":"none","stopwords_count":"~200"},"result":{"employment_negation":"working","mlops_variants":"3 patterns","role_nlp_inference":"5 roles","stopwords_count":"~250","total_tests":"all passing","regressions":0},"delta":"Negation for 4 employment types, 3 MLOps patterns, 5 role→skill NLP mappings, 50+ stopWords","verdict":"keep","improvement_description":"Employment type filters now support negation (정규직 빼고, 계약직 제외). MLOps regex matches ML/Ops, ML Ops, MLOps variants. NLP parser adds role-based skill inference for common Korean role titles. 50+ new stopWords prevent common Korean query words from polluting title/company search."}
{"id":"EXP-146","name":"role-skill-nlp-or-fix","timestamp":"2026-04-06T10:10:00Z","skill":"job-tracking","metric":"nlp_query_correctness","hypothesis":"Role-based NLP skill inference used AND logic requiring all skills present — semantically wrong, 백엔드 jobs don't use Java AND Python AND Node.js simultaneously","change":"Changed role-based skill filters from individual AND entries to single OR group: (j.skills LIKE '%node.js%' OR j.skills LIKE '%python%' OR j.skills LIKE '%java%')","baseline":{"백엔드_query_results":0,"nlp_sql_tests":"37/38"},"result":{"백엔드_query_results":"4 (incl 2 백엔드-titled)","nlp_sql_tests":"38/38","all_other_tests":"PASS","regressions":0},"delta":"1 test fixed, 백엔드 queries now return results, 0 regressions","verdict":"keep","improvement_description":"Role-based skill inference in NLP parser now uses OR logic instead of AND. Previously '백엔드 공고' required a job to have node.js AND python AND java in its skills — zero real jobs matched. Now uses OR (any one of the typical backend skills), correctly matching Java-only or Python-only backend jobs. Fixed the last failing test in test_nlp_sql_integration.js."}
{"id":"EXP-147","name":"korean-seniority-title-career-stage","timestamp":"2026-04-06T11:04:00Z","skill":"job-scraping+job-matching","metric":"career_stage_accuracy","hypothesis":"Korean organizational titles (조직장/팀장/수석/책임/선임) and title-embedded year ranges (12년~20년) were invisible to deriveCareerStageFromTitle, causing lead/senior positions to get career_stage=mid","change":"Added 8 Korean lead-level titles (조직장/팀장/파트장/그룹장/실장/본부장/센터장/수석), 2 senior titles (책임/선임), year range extraction (N년~M년, N-M년), and year minimum (N년+) to deriveCareerStageFromTitle","baseline":{"korean_title_patterns":4,"year_range_detection":false,"total_tests":"~1796"},"result":{"korean_title_patterns":14,"year_range_detection":"2 format families","new_tests":30,"total_tests":"~1826","regressions":0},"delta":"+10 Korean title patterns, +year range detection, +30 tests, 0 regressions","verdict":"keep","improvement_description":"Korean organizational titles and title-embedded year ranges now correctly map to career stages. 조직장/팀장/수석→lead, 책임/선임→senior. Year ranges like (12년~20년)→lead, (5-10년)→senior. Live validation: Wanted API 조직장 jobs now correctly get career_stage=lead instead of mid."}
{"id":"EXP-148","name":"domain-coverage-8-missing-skills","timestamp":"2026-04-06T15:04:00Z","skill":"job-matching","metric":"domain_coverage","hypothesis":"8 skills in SKILL_MAP (vitest, dynamodb, cloudwatch, mybatis, msa, opensearch, celery, webflux) had no PRIMARY_DOMAINS mapping, causing domain overlap detection to fail for jobs requiring these skills","change":"Added 8 skill→domain mappings: vitest→js/ts, dynamodb/cloudwatch→cloud, mybatis/msa/webflux→java, opensearch→data, celery→python. Also updated DOMAIN_MAP in tests/run-match-tests.js.","baseline":{"domain_coverage":"114/122 skills mapped","missing":8,"test_validated_matching":"127/128 passed, 1 failed"},"result":{"domain_coverage":"122/122 skills mapped","missing":0,"test_validated_matching":"128/128 passed","all_tests":"1898/1898 passed, 0 failed"},"delta":"+8 domain mappings, 1 test fixed, 0 regressions","verdict":"keep","improvement_description":"All 122 skills in SKILL_MAP now have domain mappings. Previously, jobs requiring vitest, dynamodb, cloudwatch, mybatis, msa, opensearch, celery, or webflux would not trigger domain overlap detection — a Python developer applying for a webflux-heavy job would not get the cross-domain penalty. This fixes the last failing test in test_validated_matching.js."}
{"id":"EXP-150","name":"experience-context-rawCompany-cleanup","timestamp":"2026-04-06T19:10:00Z","skill":"job-scraping","metric":"company_extraction_accuracy","hypothesis":"rawCompany pattern captures Korean chars before 경력 including experience context like 이상/중급, contaminating company names (e.g., 이상케이투스코리아 instead of 케이투스코리아)","change":"Added EXP_CONTEXT regex to strip leading experience-related words (이상/이하/미만/무관/이내/부터/까지/고급/중급/초급/수습) from rawCompany after extraction. Added 3 live test cases. Renamed 4 stale legacy test files to prevent node --test failures.","baseline":{"live_wanted_tests":"9/9","contaminated_company_cases":3,"node_test_failures":4},"result":{"live_wanted_tests":"12/12","contaminated_company_cases":0,"node_test_failures":0,"all_tests":"ALL PASS","regressions":0},"delta":"+3 tests, 3 company contamination fixes, 4 stale files cleaned, 0 regressions","verdict":"keep","improvement_description":"Fixed rawCompany contamination where experience context words (이상, 중급, 고급) were concatenated to company names in Wanted's glued text format. Previously '5년 이상케이투스코리아경력' extracted company as '이상케이투스코리아'. Now correctly strips experience context to get '케이투스코리아'. Also cleaned 4 stale legacy test files that caused node --test to report failures."}
{"id":"EXP-151","name":"newbie-range-career-stage","timestamp":"2026-04-06T20:04:00Z","skill":"job-scraping+job-matching","metric":"career_stage_accuracy","hypothesis":"신입-N년 and 0-N년 patterns in job titles always returned career_stage=junior because 신입 pattern matched before year range logic. Live Wanted data shows 프론트엔드 개발자(신입-5년) getting junior when the position accepts up to mid-level candidates.","change":"Added newbie-to-N-year range pattern (신입-N년, 0~N년) before generic 신입 check in deriveCareerStageFromTitle. Upper bound determines career stage: ≤3→junior, ≤7→mid, ≤12→senior, >12→lead. 15 new test cases.","baseline":{"신입-5년":"junior","신입-10년":"junior","0-3년":"junior","total_tests":"~1898"},"result":{"신입-5년":"mid","신입-10년":"senior","0-3년":"junior","신입_고정":"junior","total_tests":"~1913","new_tests":15,"regressions":0},"delta":"신입-N년 now uses upper bound, +15 tests, 0 regressions","verdict":"keep","improvement_description":"Career stage for newbie-range patterns (신입-N년, 0-N년) now derived from upper year bound instead of always returning junior. Live Wanted API shows jobs like '프론트엔드 개발자(신입-5년)' accepting mid-level candidates — previously got career_stage=junior, now correctly mid. '개발자(신입-10년)' now senior. Plain '신입 개발자' still correctly returns junior."}
{"id":"EXP-154","name":"experience-newbie-false-positive","timestamp":"2026-04-06T23:04:00Z","skill":"job-scraping","metric":"experience_extraction_accuracy","hypothesis":"Wanted JD descriptions contain 신입사원 (new employee) in benefits sections, triggering false experience=신입 for senior/mid positions. The regex /자격요건[^]*신입/ matches 신입 inside 신입사원 OJT (onboarding program), contaminating experience field for non-entry-level jobs","change":"Added (?!사원) negative lookahead to 신입 regex in extractExperienceRange(). Added Priority 5 for 신입/경력 pattern → 무관 (any experience). 10 new test cases.","baseline":{"미리캔버스_시니어_exp":"신입 (wrong)","미리캔버스_백엔드_exp":"신입 (wrong)","total_tests":1843},"result":{"미리캔버스_시니어_exp":"경력 (correct)","미리캔버스_백엔드_exp":"경력 (correct)","신입사원_false_positive":"fixed","신입경력_variant":"무관","total_tests":1853,"new_tests":10,"regressions":0},"delta":"2 live jobs fixed, +10 tests, 신입/경력→무관 support, 0 regressions","verdict":"keep","improvement_description":"Fixed experience extraction false positive where 신입사원 OJT in company benefits sections triggered experience=신입 for senior and mid-level positions. Real-world impact: 미리캔버스 시니어 프론트엔드 개발자 was tagged as 신입 (entry) instead of 경력 (experienced). Added negative lookahead (?!사원) to prevent matching inside 신입사원. Also added support for 신입/경력, 신입·경력, 신입,경력 patterns → experience=무관 (accepts all levels). 10 test cases covering: standalone 신입, 신입사원 false positive, 신입/경력 variants, combined cases, and real Wanted JD text."}
{"id":"EXP-155","name":"calendar-year-false-positive","timestamp":"2026-04-07T00:04:00Z","skill":"job-scraping+job-matching","metric":"career_stage_accuracy","hypothesis":"deriveCareerStage matched calendar years (21년도 = year 2021) as 21 years of experience → lead. Scraper fallback passed entire descriptions to deriveCareerStage, picking up unrelated year mentions from company backgrounds.","change":"Added (?![가-힣]) negative lookahead to all 년 regexes in deriveCareerStage and deriveCareerStageFromTitle. Constrained scraper fallback to only pass 자격요건 section instead of full description. 18 test cases.","baseline":{"21년도":"lead (wrong)","19년도":"lead (wrong)","미리캔버스_백엔드":"lead (wrong)","total_tests":1843},"result":{"21년도":"null (correct)","19년도":"null (correct)","미리캔버스_백엔드":"mid (correct)","total_tests":1861,"new_tests":18,"regressions":0},"delta":"+18 tests, calendar year false positive fixed, scraper fallback constrained, 0 regressions","verdict":"keep","improvement_description":"Calendar years in Korean text (21년도, 19년도 etc.) no longer false-positive as experience years in deriveCareerStage. The regex /(\d+)\\s*년/ matched '21년' inside '21년도부터' (since 2021), causing career_stage=lead for regular mid-level positions. Fixed with negative lookahead (?![가-힣]). Also constrained the scraper --details fallback to only pass the 자격요건 section to deriveCareerStage instead of the entire job description, preventing unrelated year mentions ('2년 연속 흑자', '24년에 시리즈 B') from overriding the career stage."}
{"id":"EXP-001","name":"skill↑ commute↓","timestamp":"2026-04-07T01:05:11.618Z","metrics":{"discrimination":49.2,"positive_avg":80.2,"negative_avg":31,"borderline_avg":51,"accuracy":80},"delta":-3.33,"verdict":"revert"}
{"id":"EXP-002","name":"skill↑↑ commute↓","timestamp":"2026-04-07T01:05:11.619Z","metrics":{"discrimination":52.53,"positive_avg":79.2,"negative_avg":26.67,"borderline_avg":48,"accuracy":90},"delta":0,"verdict":"revert"}
{"id":"EXP-003","name":"experience↑ preferred↓","timestamp":"2026-04-07T01:05:11.619Z","metrics":{"discrimination":47.4,"positive_avg":83.4,"negative_avg":36,"borderline_avg":55.5,"accuracy":80},"delta":-5.13,"verdict":"revert"}
{"id":"EXP-004","name":"work_type↑ commute↓","timestamp":"2026-04-07T01:05:11.620Z","metrics":{"discrimination":47.4,"positive_avg":80.4,"negative_avg":33,"borderline_avg":52,"accuracy":80},"delta":-5.13,"verdict":"revert"}
{"id":"EXP-005","name":"balanced high-skill","timestamp":"2026-04-07T01:05:11.620Z","metrics":{"discrimination":51.67,"positive_avg":80,"negative_avg":28.33,"borderline_avg":49,"accuracy":90},"delta":-0.86,"verdict":"revert"}
{"id":"EXP-006","name":"exp+worktype focus","timestamp":"2026-04-07T01:05:11.620Z","metrics":{"discrimination":44.73,"positive_avg":83.4,"negative_avg":38.67,"borderline_avg":57,"accuracy":70},"delta":-7.8,"verdict":"revert"}
