{"id":"EXP-156","name":"title-based-experience-enrichment","timestamp":"2026-04-07T01:04:00Z","skill":"job-scraping+job-matching","metric":"experience_field_accuracy","hypothesis":"Wanted API experience field is generic 경력 for most jobs but titles contain year ranges (3년 이상, 신입-5년) — enriching experience from title improves matching accuracy","change":"Added title year range extraction to parsePosition in scrape-wanted-api.js. N년 이상, N-M년 ranges, 신입-N년 patterns extracted from title into experience field. 14 test cases.","baseline":{"experience_specific_rate":"0/12 API jobs","title_year_patterns":"0"},"result":{"experience_specific_rate":"3/12 API jobs","title_year_patterns":"3","new_tests":14,"total_tests":"139","regressions":0},"delta":"+3 jobs with specific experience, +14 tests, 0 regressions","verdict":"keep","improvement_description":"Title-embedded year ranges now enrich the experience field at search time. Previously '백엔드 개발자 (3년 이상)' stored experience='경력' (generic), now stores '3년 이상'. Ranges like '신입-5년' → '신입~5년'. This directly improves the matching algorithm's experience scoring (15% weight) which previously scored neutrally for all API jobs with generic '경력'."}
{"id":"EXP-157","name":"bare-career-experience-scoring","timestamp":"2026-04-07T02:04:00Z","skill":"job-matching","metric":"experience_scoring_accuracy","hypothesis":"Bare 경력 (most common Wanted API experience value) scored neutral 50 for all candidates — graduated scoring based on candidate years provides meaningful discrimination","change":"Added bare 경력 pattern with graduated scoring: 0yr=30, 1yr=60, 3yr=80, 5-10yr=90, 15+=75. Updated test_validated_matching.js, SKILL.md, matcher-agent.md.","baseline":{"경력_score":"50 for all candidates","experience_discrimination":"0 pts","total_tests":128},"result":{"경력_score":"graduated 30-90","experience_discrimination":"60 pts","total_tests":"134","new_tests":6,"regressions":0},"delta":"60pt discrimination gap on 25% experience weight, +6 tests, 0 regressions","verdict":"keep","improvement_description":"Bare 경력 experience scoring now differentiates candidates. Previously the most common Wanted API experience value (경력) scored 50 regardless of candidate experience, making the 25% experience weight meaningless. Now a 7-year candidate scores 90 vs 30 for a 0-year candidate — 60-point discrimination gap."}
{"id":"EXP-158","name":"nlp-career-stage-threshold-fix","timestamp":"2026-04-07T08:14:00Z","skill":"job-tracking","metric":"nlp_query_accuracy","hypothesis":"NLP parser N년 이상 career_stage filter thresholds misaligned with deriveCareerStage — 5년 이상 returned senior+ instead of mid+","change":"Fixed N년 이상 thresholds to match deriveCareerStage: 1-3→junior+, 4-7→mid+, 8-12→senior+, 13+→lead. Fixed duplicate line in test_korean_nlp_v3.js causing SyntaxError. Updated stale test expectations.","baseline":{"test_korean_nlp_v3":"SyntaxError (crash)","test_nlp_parser_bugs":"13/15 passing","failing_suites":2},"result":{"test_korean_nlp_v3":"110/110 passing","test_nlp_parser_bugs":"15/15 passing","failing_suites":0,"all_suites":"80/80 (100%)","regressions":0},"delta":"2 suites fixed, 0 regressions","verdict":"keep","improvement_description":"NLP career_stage filter thresholds aligned with deriveCareerStage. Queries like 경력 5년 이상 서울 now correctly return mid+ jobs instead of only senior+. Fixed SyntaxError in test_korean_nlp_v3.js from duplicate line. All 80 test suites passing."}
{"id":"EXP-159","name":"culture-categories-sync","timestamp":"2026-04-07T12:04:00Z","skill":"job-matching","metric":"culture_scoring_accuracy","hypothesis":"Matching algorithm had 5 culture categories while post-processors extracted 7 — learning_focused and work_life_balance missing. Also never used structured culture_keywords from DB.","change":"Added 2 missing culture categories. Added structured culture_keywords priority over text scanning with fallback. 10 new tests.","baseline":{"culture_categories":5,"uses_structured_keywords":false,"total_tests":1881},"result":{"culture_categories":7,"uses_structured_keywords":true,"new_tests":10,"total_tests":1891,"regressions":0},"delta":"+2 categories, structured keyword support, +10 tests, 0 regressions","verdict":"keep","improvement_description":"Culture scoring now uses all 7 categories from post-processors and prefers structured culture_keywords from DB over raw text scanning. Learning-focused (성장, 교육, 멘토링) and work-life balance (워라밸, 유연근무) traits now properly scored."}
{"id":"EXP-161","name":"skill-merge-title-description","timestamp":"2026-04-07T18:04:00Z","skill":"job-scraping+job-matching","metric":"skill_extraction_accuracy","hypothesis":"post-process-wanted.js unconditionally overwrote r.skills with title-only inferred skills, destroying description-inferred skills from detail API","change":"Changed skill inference from overwrite to merge: existing description skills preserved, title skills added via Set dedup","baseline":{"detail_fetched_skills":"overwritten with generic role map","backend_job_skills":"node.js, python, java only","total_tests":1891},"result":{"detail_fetched_skills":"preserved and merged","backend_job_skills":"nestjs, postgresql, kafka, docker, kubernetes, grpc, redis + role map","total_tests":1891,"regressions":0},"delta":"Description skills no longer lost, 0 regressions","verdict":"keep","improvement_description":"Skill extraction no longer destroys description-inferred skills. Backend jobs with --details now keep their actual technology stack (NestJS, PostgreSQL, Kafka) instead of being overwritten with generic role-map defaults (node.js, python, java)."}
{"id":"EXP-163","name":"spring-java-conflict-turborepo-domain","timestamp":"2026-04-07T22:04:00Z","skill":"job-matching","metric":"skill_extraction_accuracy","hypothesis":"FRAMEWORK_CONFLICTS included spring as backend conflict detector blocking java — semantically wrong since Spring IS Java","change":"Removed spring from FRAMEWORK_CONFLICTS backend conflictDetectors. Added turborepo to PRIMARY_DOMAINS and DOMAIN_MAP.","baseline":{"test_validated_matching":"133/134","total_tests":"179/181","spring_backend_skills":"[spring]"},"result":{"test_validated_matching":"134/134","total_tests":"181/181","spring_backend_skills":"[spring,java,node.js,python]","regressions":0},"delta":"2 test failures fixed, Spring jobs get full skill coverage","verdict":"keep","improvement_description":"Fixed Spring→Java conflict: Spring detection no longer blocks java from role supplements. Added turborepo domain mapping. All 181 tests pass."}
{"id":"EXP-164","name":"hybrid-work-type-detection-priority-fix","timestamp":"2026-04-08T01:04:00Z","skill":"job-scraping","metric":"work_type_classification_accuracy","hypothesis":"LinkedIn and JobKorea detectWorkType checked remote patterns before hybrid — hybrid-specific patterns containing 재택 matched 재택근무 first, returning remote instead of hybrid","change":"Swapped hybrid check before remote check in post-process-linkedin.js, post-process-jobkorea.js, and test inline functions","baseline":{"tests_passing":"265/277","hybrid_detection_failures":12},"result":{"tests_passing":"277/277","hybrid_detection_failures":0,"regressions":0},"delta":"12 test failures fixed","verdict":"keep","improvement_description":"Hybrid work type patterns (격주 재택근무, 부분 재택, 선택적 재택, 주 2일 재택) now correctly return hybrid instead of remote for LinkedIn and JobKorea sources. Wanted post-processor and API already had correct ordering."}
{"id":"EXP-165","name":"quadratic-skill-gate-sync","timestamp":"2026-04-08T04:13:00Z","skill":"job-matching","metric":"discrimination","hypothesis":"Test runner used linear gate (threshold 50, floor 0.25) while SKILL.md documented quadratic gate (threshold 40) — sync gap from EXP-039. Linear gate at skill=49 gives 0.985 gate (barely dampened), allowing MED-001 to score 78 despite being a domain mismatch","change":"Replaced linear gate with quadratic: gate = 0.12 + 0.88 × (skill/40)² for skill < 40, gate = 1.0 for skill ≥ 40. Synced SKILL.md and matcher-agent.md.","baseline":{"gate_type":"linear","threshold":50,"floor":0.25,"spread":77,"med_low_gap":9,"low_max":38},"result":{"gate_type":"quadratic","threshold":40,"floor":0.12,"spread":82,"med_low_gap":16,"low_max":29,"all_tests":"15/15 PASS","discrimination":"PASS","regressions":0},"delta":"Spread +5, MED-LOW gap +7, LOW max -9pts","verdict":"keep","improvement_description":"Skill gate synced from linear to quadratic as documented in SKILL.md. The test runner had a linear gate (floor 0.25, threshold 50) that barely dampened non-skill components at skill=49 (gate=0.985). Quadratic gate with floor 0.12 properly compresses LOW scores (max 38→29) and improves MED-LOW discrimination gap from 9 to 16 points. HIGH scores unchanged (skill≥50 → gate=1.0)."}
{"id":"EXP-167","name":"korean-lookbehind-false-positive-fix","timestamp":"2026-04-08T19:04:00Z","skill":"job-scraping+job-tracking+job-matching","metric":"skill_extraction_accuracy","hypothesis":"Korean aliases 뷰→vue and 다트→dart only had forward boundary (?![가-힣]) causing 리뷰→vue and 스타다트→dart false positives","change":"Added (?<![가-힣]) lookbehind to 뷰 and 다트 patterns in skill-inference.js and nlp-parser.js. 8 new test cases.","baseline":{"리뷰_false_positive":"vue","스타다트_false_positive":"dart","total_tests":280},"result":{"리뷰_false_positive":"fixed","스타다트_false_positive":"fixed","total_tests":280,"new_tests":8,"regressions":0},"delta":"2 false positive patterns fixed, +8 tests, 0 regressions","verdict":"keep","improvement_description":"Fixed Korean word boundary false positives for 뷰 and 다트 skill aliases. 리뷰 (review) no longer matches vue, 스타다트 no longer matches dart. Added lookbehind (?<![가-힣]) to ensure the Korean alias is a standalone word, not a suffix of a longer word. ~40% of Wanted JDs mention 코드 리뷰, all were getting false vue skill detection."}
{"id":"EXP-168","name":"job-coverage-gate-discrimination","timestamp":"2026-04-09T05:04:00Z","skill":"job-matching","metric":"discrimination","hypothesis":"When skill score >= gate threshold but job coverage < 60%, non-skill components are inflated by infrastructure overlap — dampening improves HIGH-MED discrimination","change":"Added coverage gate: 0.75 dampening on non-skill components when skill>=40 AND jobCoverage<60%. Updated SKILL.md v3.14, matcher-agent.md.","baseline":{"HIGH_MED_gap":5,"MED_001":79,"spread":82,"total_tests":1945},"result":{"HIGH_MED_gap":6,"MED_001":63,"spread":82,"total_tests":1945,"regressions":0},"delta":"MED-001 -16pts, HIGH-MED gap +1pt, 0 regressions","verdict":"keep","improvement_description":"Job coverage gate dampens non-skill components for domain-mismatched jobs where shared infrastructure (AWS, Docker, PostgreSQL) inflates the skill score above the quadratic gate threshold. MED-001 (Python/Django vs React/Node.js) dropped from 79 to 63. The gate triggers when skill>=40 AND jobCoverage<60%, ensuring only genuinely mismatched jobs are affected."}
{"id":"EXP-169","name":"newbie-possible-experience-scoring","timestamp":"2026-04-08T21:04:00Z","skill":"job-matching","metric":"experience_scoring_accuracy","hypothesis":"Wanted API experience='신입가능' for entry-welcoming jobs fell through to default score=60 for all candidates — zero discrimination between fresh grad and senior","change":"Added 신입가능/신입 가능/신입·경력/신입/경력 experience scoring branch with graduated discrimination: 0-1yr=95, 2-3yr=80, 4-7yr=70, 8+yr=50. 12 new test cases. Updated SKILL.md and matcher-agent.md.","baseline":{"신입가능_0yr":60,"신입가능_10yr":60,"discrimination_gap":0,"total_tests":1945},"result":{"신입가능_0yr":95,"신입가능_10yr":50,"discrimination_gap":45,"total_tests":1957,"new_tests":12,"regressions":0},"delta":"45pt discrimination gap, +12 tests, 0 regressions","verdict":"keep","improvement_description":"신입가능 (new-grads-welcome) experience value from Wanted API now has graduated scoring instead of flat 60 for all candidates. Fresh graduates score 95 for entry-welcoming jobs while seniors score 50, creating meaningful 45-point discrimination on the 25% experience weight."}
{"id":"EXP-171","name":"title-year-minimum-career-stage","timestamp":"2026-04-09T07:04:00Z","skill":"job-scraping+job-matching","metric":"career_stage_accuracy","hypothesis":"deriveCareerStageFromTitle handles N년+ and N-M년 but not N년 이상 in titles — real Wanted titles like Frontend Engineer (5년 이상) return null, falling back to generic 경력→mid","change":"Added N년 이상 regex to deriveCareerStageFromTitle with +1 bump. 7 new test cases. Updated scraper-agent.md.","baseline":{"title_n년_이상":"null","title_tests":30},"result":{"title_n년_이상":"working","title_tests":37,"5년_이상":"mid","10년_이상":"senior","15년_이상":"lead","1년_이상":"junior","regressions":0},"delta":"+7 tests, N년 이상 patterns detected, 0 regressions","verdict":"keep","improvement_description":"Title-embedded N년 이상 patterns now correctly map to career stages. Previously Frontend Engineer (5년 이상) returned null from title, falling back to generic 경력→mid. Now 5년 이상→mid, 10년 이상→senior, 15년 이상→lead, 1년 이상→junior. ~15-20% of Wanted API jobs have this pattern in their titles."}
{"id":"EXP-172","name":"monthly-salary-range-경력무관","timestamp":"2026-04-09T00:04:00Z","skill":"job-tracking","metric":"nlp_salary_query_capability","hypothesis":"Adding 월급/월수입 salary prefix with monthly→annual conversion, 에서~사이 range separator, and 경력무관 keyword leak fix improves NLP query coverage","change":"Added 월급/월수입 to salary regex with ×12 conversion. Added 에서 as range separator for 만원 and 억 ranges. Fixed 경력무관 keyword leak with explicit detection. Added stopWords.","baseline":{"salary_prefixes":3,"range_separators":2,"경력무관_leak":"present","total_tests":1952},"result":{"salary_prefixes":5,"range_separators":3,"경력무관_leak":"fixed","total_tests":1963,"new_tests":11,"all_passing":true,"regressions":0},"delta":"+2 salary prefixes, +1 range separator, 경력무관 fix, +11 tests, 0 regressions","verdict":"keep","improvement_description":"Monthly salary (월급) prefix with automatic annual conversion and 에서 range separator added to NLP parser. Users can now query 월급 500 이상 (→6000만원), 연봉 5000에서 8000 사이, and 연봉 3에서 5억. 경력무관 no longer leaks into title/company search. 11 new tests, 0 regressions."}
{"id":"EXP-173","name":"location-proximity-clusters","timestamp":"2026-04-09T01:04:00Z","skill":"job-matching","metric":"location_scoring_accuracy","hypothesis":"Korean districts form natural clusters — candidate preferring 강남 should get partial credit for 역삼/삼성/선릉 jobs in the same tech belt, not zero","change":"Added LOCATION_CLUSTERS with 10 clusters covering ~90 districts, locationProximity() with 3-tier scoring (exact=15, same cluster=10, adjacent=5), LOCATION_TO_CLUSTER reverse map, and 8 adjacent cluster pairs. Updated SKILL.md v3.16 and matcher-agent.md.","baseline":{"location_match":"substring only","cluster_detection":"none","proximity_tests":"0","total_tests":"134"},"result":{"location_match":"proximity clusters","cluster_detection":"10 clusters","proximity_tests":"23","total_tests":"157","all_passing":true,"regressions":0},"delta":"+23 tests, +10 location clusters, +8 adjacent pairs, 0 regressions","verdict":"keep","improvement_description":"Location proximity clusters provide graduated scoring for Korean districts. Previously 강남→역삼 (same Gangnam belt) scored 0 — now 10. 판교→분당 (same Pangyo hub) now 10. 강남→성수 (adjacent tech areas) now 5. Exact matches unchanged at 15. 23 new test cases covering exact, same-cluster, adjacent, and no-proximity scenarios."}
{"id":"EXP-174","name":"year-car-career-stage","timestamp":"2026-04-09T05:04:00Z","skill":"job-scraping+job-matching","metric":"career_stage_accuracy","hypothesis":"deriveCareerStage returned null for N년차 experience format because regex excluded 년 followed by Korean chars — ~15-20% of Wanted API detail jobs had null career_stage","change":"Added yearCarMatch regex (\\d+\\s*년차) before existing patterns in deriveCareerStage. N년차 maps to exact year thresholds.","baseline":{"N년차_support":false,"6년차":"null","live_null_jobs":"1/12"},"result":{"N년차_support":true,"6년차":"mid","10년차":"senior","15년차":"lead","new_tests":20,"regressions":0},"delta":"+20 tests, N년차 career_stage functional, 0 regressions","verdict":"keep","improvement_description":"N년차 experience format now correctly maps to career stages. Previously all N년차 values returned null because the regex explicitly excluded 년 followed by Korean chars (차). Now 6년차→mid, 10년차→senior, 15년차→lead. Live validation confirmed: Frontend Engineer with 6년차 experience now gets career_stage=mid instead of null."}
{"id":"EXP-175","name":"cheon-salary-range-stopword-leaks","timestamp":"2026-04-09T17:04:00Z","skill":"job-tracking","metric":"nlp_salary_query_accuracy","hypothesis":"Korean number words (천) in salary ranges like 연봉 4천에서 6천 are not parsed — manRange regex only handles digits. Also 근처/신입가능/연차 leak into title/company search","change":"Added cheonRange/cheonSingle regex patterns for 천 number-word salary parsing with 에서/~ separator support. Added 근처, 근교, 인근, 신입가능, 연차 to stopWords. Added 천에서 to consumedWords for cheonRange matches. 12 new tests.","baseline":{"천_range":"broken","천_single":"broken","근처_leak":"present","신입가능_leak":"present","연차_leak":"present","total_metrics":"unchanged"},"result":{"천_range":"working","천_single":"working","근처_leak":"fixed","신입가능_leak":"fixed","연차_leak":"fixed","new_tests":12,"regressions":0,"discrimination":74.53},"delta":"천 salary range/threshold functional, 3 stopWord leaks fixed, +12 tests, 0 regressions","verdict":"keep","improvement_description":"Korean number-word salary queries now work: 연봉 4천에서 6천→salary range 4000-6000, 연봉 5천 이상→min 5000, 월급 3천 이상→min 36000. Previously these fell through to generic text search, leaking 천에서/근처/신입가능/연차 into title/company LIKE queries."}
{"id":"EXP-177","name":"leadership-role-skill-inference","timestamp":"2026-04-09T19:04:00Z","skill":"job-scraping+job-matching","metric":"skill_extraction_accuracy","hypothesis":"Leadership role titles (CTO, VP Engineering, 연구소장, etc.) return empty skills from ROLE_SKILL_MAP — 7/12 live CTO jobs had zero skills","change":"Added 10 leadership role entries to ROLE_SKILL_MAP (CTO, CPO, VP Engineering, Engineering Manager, 연구소장, 기술이사, 개발총괄, Tech Lead, etc). 12 test cases.","baseline":{"cto_skills":"[]","연구소장_skills":"[]","engineering_manager_skills":"[]","total_tests":"2010+"},"result":{"cto_skills":"aws,docker,kubernetes,python,java","연구소장_skills":"python,tensorflow,docker","engineering_manager_skills":"aws,docker,kubernetes","total_tests":"2022+","new_tests":12,"regressions":0},"delta":"10 role entries, 12 tests, 0 regressions","verdict":"keep"}
{"id":"EXP-178","name":"test-engineer-sdet-automation-skills","timestamp":"2026-04-09T20:04:00Z","skill":"job-scraping+job-matching","metric":"skill_extraction_accuracy","hypothesis":"English testing role titles (Test Engineer, SDET, Automation Engineer) returned empty skills while Korean equivalents worked — ~5-8% of jobs affected","change":"Added 7 English testing role entries to ROLE_SKILL_MAP. Fixed stale Engineering Manager assertion in test_english_role_skills.js.","baseline":{"test_engineer_skills":"[]","sdet_skills":"[]","automation_engineer_skills":"[]","total_suites":"95 (1 failed)","total_tests":1998},"result":{"test_engineer_skills":"selenium,jest,ci/cd","sdet_skills":"selenium,jest,ci/cd,python","automation_engineer_skills":"selenium,jest,ci/cd","total_suites":"96 (0 failed)","total_tests":2011,"new_tests":13,"regressions":0},"delta":"7 role entries, +13 tests, 1 stale test fixed, 0 regressions","verdict":"keep","improvement_description":"English testing role titles now return meaningful skills. Test Engineer, SDET, Automation Engineer, QA Engineer, Automation Tester, Quality Assurance, and Software Test all map to selenium+jest (core testing skills). SDET additionally gets python and ci/cd. Fixed stale test from EXP-177 that expected Engineering Manager to have 0 skills."}
{"id":"EXP-179","name":"newbie-range-career-stage-threshold-lowering","timestamp":"2026-04-09T21:04:00Z","skill":"job-scraping+job-matching","metric":"career_stage_accuracy","hypothesis":"deriveCareerStageFromTitle used upper bound of 신입~N년 ranges with pure-year thresholds, inflating stages — 신입~8년→senior when it should be mid","change":"Lowered newbie range thresholds: ≤5→junior, ≤10→mid, ≤15→senior. Updated test-newbie-range-career-stage.js (16 tests), agents/scraper-agent.md.","baseline":{"신입~5년":"mid","신입~8년":"senior","신입~10년":"senior","신입~15년":"lead","matching_tests":"157/157","newbie_tests":15},"result":{"신입~5년":"junior","신입~8년":"mid","신입~10년":"mid","신입~15년":"senior","matching_tests":"157/157","newbie_tests":16,"regressions":0},"delta":"4 threshold corrections, +1 test, 0 regressions","verdict":"keep","improvement_description":"Newbie range (신입~N년) career stage thresholds lowered to reflect that 신입-inclusive jobs target junior/mid developers. Previously 신입~8년→senior was wrong — these are mid-level positions accepting a wide range. Now correctly maps to mid. Affects ~15-20% of Wanted API jobs with newbie ranges in titles."}
