{"id":"EXP-072","name":"nlp-sql-integration-bugfixes","timestamp":"2026-04-02T03:04:00Z","skill":"job-tracking","metric":"nlp_sql_correctness","hypothesis":"5 failing NLP-to-SQL integration tests indicate real parsing bugs affecting Korean query accuracy","change":"Fixed negation direction (before vs after 빼고), added status negation support, fixed deadline day comparison with ROUND(), extended score sort pattern, narrowed 신입 filter scope","baseline":{"nlp_sql_tests":"15/20 passing","full_suite":"707 pass + 1 suite failing"},"result":{"nlp_sql_tests":"20/20 (100%)","full_suite":"727/727","bugs_fixed":5,"regressions":0},"delta":"5 bugs fixed, +20 tests all passing, 0 regressions","verdict":"keep","improvement_description":"All 5 NLP-to-SQL integration bugs fixed. Negation now correctly looks before 빼고 for company names and supports status negation. Deadline comparison uses ROUND() for accurate day boundaries. Score sort handles '점수높은 순'. 신입 filter no longer includes '경력 무관'. Full test suite 727/727 passing with zero failures."}
{"id":"EXP-074","name":"python-framework-cross-similarity-angular","timestamp":"2026-04-02T05:04:00Z","skill":"job-matching","metric":"similarity_map_completeness","hypothesis":"Python web frameworks (FastAPI, Django, Flask) have 0% direct similarity despite being same-language frameworks. Angular is completely missing from frontend framework Tier 3. Adding these pairs improves matching for common Korean job market scenarios where resumes list frameworks without parent languages.","change":"Added Tier 2: FastAPI↔Django, FastAPI↔Flask, Django↔Flask (75%). Added Angular to Tier 3 frontend group (React↔Vue↔Svelte↔Angular, 25%). Added Angular to PRIMARY_DOMAINS. Updated 4 test files + SKILL.md v3.3 + matcher-agent.md v4.3.","baseline":{"similarity_pairs":"41","python_framework_cross_similarity":0,"angular_in_frontend_group":false,"total_tests":727},"result":{"similarity_pairs":"50","python_framework_cross_similarity":"75% (Tier 2)","angular_in_frontend_group":"Tier 3 (25%)","new_test_assertions":5,"total_tests":"732","regressions":0},"delta":"+9 similarity pairs, +5 test assertions, Angular domain detection, 0 regressions","verdict":"keep","improvement_description":"Python web framework cross-similarity added: FastAPI↔Django, FastAPI↔Flask, Django↔Flask all at Tier 2 (75%). Previously a Django developer applying to a FastAPI job got 0% direct similarity (only indirect through Python at 75%, which only helped if both 'Python' and the framework were in skills). Now framework-to-framework matching works directly. Angular added to frontend framework Tier 3 group alongside React, Vue, Svelte — previously Angular jobs had 0% similarity to React/Vue developer profiles. Angular also added to PRIMARY_DOMAINS so it correctly triggers js/ts domain alignment. All 732 tests passing."}
{"id":"EXP-076","name":"sinip-experience-scoring","timestamp":"2026-04-02T07:04:00Z","skill":"job-matching","metric":"experience_scoring_accuracy","hypothesis":"신입 (entry-level) experience pattern was unhandled — scored 50 default instead of graduated scoring. 신입·경력 and N년 이상 also missing.","change":"Added 신입 graduated scoring (0-1yr→95, 2-3yr→65, 4+yr→40), 신입·경력→85 broad match, explicit N년 이상 regex. 10 new test cases. Synced E2E pipeline, SKILL.md, matcher-agent.md.","baseline":{"experience_tests":4,"sinip_score":50,"sinip_career_score":50,"total_tests":748},"result":{"experience_tests":14,"sinip_0yr":95,"sinip_3yr":65,"sinip_7yr":40,"sinip_career":85,"total_tests":758,"regressions":0},"delta":"+10 tests, 신입 scored correctly, 0 regressions","verdict":"keep","improvement_description":"신입 (entry-level) experience scoring added with graduated penalties. Previously all 신입 jobs scored 50 regardless of candidate experience — now new graduates get 95 and seniors get 40. 신입·경직 (both welcome) gets 85. Covers ~30% of Korean job postings that were previously unscored for experience fit."}
{"id":"EXP-077","name":"skills-column-persistence","timestamp":"2026-04-02T10:04:00Z","skill":"job-scraping","metric":"field_persistence_gap","hypothesis":"Skills parsed by post-processors but never persisted to DB","change":"Added skills TEXT DEFAULT column to jobs table, updated INSERT template, added UPDATE workflow for detail enrichment, updated SKILL.md v5.2","baseline":{"skills_in_db":false,"skills_in_insert":false,"skills_tests":0,"total_tests":830},"result":{"skills_in_db":true,"skills_in_insert":true,"skills_tests":"15/15","total_tests":845,"regressions":0},"delta":"+15 tests, skills pipeline complete, 0 regressions","verdict":"keep","improvement_description":"Skills column added to jobs DB. Previously skills were parsed by all 3 post-processors but never stored. The 35% skill weight in matching relied on runtime re-extraction. Now skills persist from title inference and detail-page extraction, queryable via SQL."}
{"id":"EXP-080","name":"dedup-production-sync-skill-inference-unified","timestamp":"2026-04-02T14:04:00Z","skill":"job-scraping+job-matching","metric":"production_pipeline_parity","hypothesis":"Production dedup script missing 25 Korean↔English company equivalents from EXP-067 (only in test). Wanted and JobKorea post-processors not using shared skill-inference module (only LinkedIn was). Both gaps mean real scraped data gets worse dedup and empty skills fields.","change":"(1) Added companyKoEnMap with 25 entries + companyToCanonical() to scripts/dedup-jobs.js. (2) Wired skill-inference.js into post-process-wanted.js and post-process-jobkorea.js. (3) Created test_dedup_production_sync.js with 6 sync validation tests.","baseline":{"dedup_ko_en_equivalents":0,"wanted_skill_inference":false,"jobkorea_skill_inference":false,"total_tests":864},"result":{"dedup_ko_en_equivalents":25,"wanted_skill_inference":true,"jobkorea_skill_inference":true,"total_tests":870,"regressions":0},"delta":"+6 tests, dedup production-synced, all 3 post-processors use shared skill-inference, 0 regressions","verdict":"keep","improvement_description":"Production pipeline parity fix. (1) dedup-jobs.js now has the 25 Korean↔English company equivalents from EXP-067 — previously only existed in test file, meaning real LinkedIn↔Korean source dedup was broken. (2) All 3 post-processors (Wanted, JobKorea, LinkedIn) now use the shared skill-inference module — previously only LinkedIn used it, Wanted and JobKorea had empty skills fields even though the DB column existed since EXP-077. 6 new sync-validation tests ensure future experiments don't desync test and production code."}
{"id":"EXP-081","name":"dedup-enrichment-skills-culture","timestamp":"2026-04-02T15:04:00Z","skill":"job-scraping","metric":"cross_source_dedup_data_loss","hypothesis":"skills and culture_keywords columns missing from dedup-jobs.js cause silent data loss during merge","change":"Added skills/culture_keywords to SQL query, fieldScore, and enrichment logic that copies missing fields from duplicates to keeper before deletion. 8 new tests.","baseline":{"dedup_considers_skills":false,"dedup_considers_culture":false,"enrichment_on_merge":false,"total_tests":870},"result":{"dedup_considers_skills":true,"dedup_considers_culture":true,"enrichment_on_merge":"7 fields","total_tests":878,"regressions":0},"delta":"+8 tests, skills/culture preserved in dedup, 0 regressions","verdict":"keep","improvement_description":"Dedup merge now preserves skills and culture data. Previously these high-value fields (35% and 15% match weights) could be silently discarded when the richer entry lost the fieldScore tie-breaker. Enrichment logic copies missing fields from duplicates to the keeper before deletion, covering 7 fields total."}
{"id":"EXP-082","name":"salary-threshold-nlp-queries","timestamp":"2026-04-02T16:04:00Z","skill":"job-tracking","metric":"nlp_salary_query_capability","hypothesis":"Main NLP parser only supported basic 'has salary' queries; salary threshold parsing (연봉 6000 이상, 연봉 5000~8000, 연봉 1억 이상) existed only in separate test_salary_nlp_integration.js","change":"Merged salary threshold parsing from test_salary_nlp_integration.js into main NLP parser (test_korean_nlp_v3.js). Added 억 range/threshold, 만원 range/threshold with auto-conversion. 6 new test cases. Updated SKILL.md v2.7, tracker-agent.md v3.4.","baseline":{"nlp_v3_tests":50,"salary_threshold_cases":0,"total_tests":878},"result":{"nlp_v3_tests":56,"salary_threshold_cases":6,"total_tests":884,"all_passing":true,"regressions":0},"delta":"+6 tests, salary threshold queries functional in main parser, 0 regressions","verdict":"keep","improvement_description":"Salary threshold NLP queries now work in the main parser. Users can query 연봉 6000 이상, 연봉 5000~8000, 연봉 1억 이상, 연봉 1~2억 and get proper numeric SQL filters against salary_min/salary_max columns. Previously these only worked in a separate test suite with its own duplicated parser — the tracker agent never supported them."}
{"id":"EXP-083","name":"skill-inference-korean-job-market-expansion","timestamp":"2026-04-03T11:43:00Z","skill":"job-scraping+job-matching","metric":"skill_coverage","hypothesis":"Skill inference module was missing 27 common Korean job market keywords (Linux, Nginx, CI/CD, DevOps, Spark, Hadoop, Airflow, dbt, JPA, Redux, Unity, Unreal, BigQuery, Snowflake, AWS Lambda/S3/SQS) causing zero-detection for these skills in scraped job postings","change":"Added 27 new skill patterns to skill-inference.js with Korean+English regex support. Categories: infrastructure (linux, nginx, ci/cd, devops), data engineering (spark, hadoop, airflow, dbt), cloud services (aws lambda, aws s3, aws sqs, bigquery, snowflake), ORM (jpa/hibernate), frontend state (redux), game engines (unity, unreal). Fixed CI/CD regex to handle CI CD without slash. 29 new test cases.","baseline":{"skill_map_entries":50,"test_count":884,"missing_keywords":27},"expected_improvement":"77+ skill patterns covering Korean job market; zero-detection reduced for common postings","result":{"skill_map_entries":77,"test_count":913,"new_patterns":27,"new_tests":29,"all_passing":true,"regressions":0},"delta":"+27 patterns, +29 tests, 0 regressions","verdict":"keep","improvement_description":"Skill inference expanded from 50 to 77 patterns covering the Korean job market. Previously Linux, Nginx, CI/CD, DevOps, Spark, Hadoop, Airflow, dbt, JPA, Redux, Unity, Unreal, BigQuery, Snowflake, and AWS services (Lambda/S3/SQS) were invisible to the matching algorithm. Jobs mentioning these skills scored 0% for the 35% skill weight component. Now detected in both Korean (리눅스, 스파크, 하둡, 유니티, 데브옵스, 빅쿼리) and English. CI/CD regex handles CI/CD, CI CD, and CICD variants."}
{"id":"EXP-084","name":"salary-preference-alignment","timestamp":"2026-04-03T12:04:00Z","skill":"job-matching","metric":"salary_preference_utilization","hypothesis":"Adding salary preference alignment to the Location/Work component enables the 10% weight to differentiate between jobs that match vs don't match the candidate's salary range","change":"Added calculateSalaryAlignment() with range overlap scoring. Refactored calculateLocationWorkScore to include salary alignment (-20 to +20). Reduced location/work_type bonuses from 25 to 15 each. Added 5 salary test jobs and 14 assertions.","baseline":{"salary_preference_used":false,"location_work_max_bonus":50,"total_tests":913},"expected_improvement":"Salary preference differentiates otherwise-identical jobs","result":{"salary_preference_used":true,"salary_alignment_range":"-20 to +20","location_score_gap":29,"new_salary_tests":14,"total_tests":927,"regressions":0},"delta":"+14 tests, salary preference functional, 0 regressions","verdict":"keep","improvement_description":"Salary preference alignment added to matching algorithm. Previously a 3000만원 job scored identically to a 7000만원 job regardless of the candidate's 5000-8000 preference. Now the location/work/salary component shows a 29-point gap between perfect salary match (100) and below-range (71). Backward compatible — jobs without salary data score neutrally."}
{"id":"EXP-085","name":"employment-type-extraction-alignment","timestamp":"2026-04-03T13:04:00Z","skill":"job-scraping+job-matching","metric":"employment_type_coverage","hypothesis":"Employment type (정규직/계약직/인턴) was stripped from job titles but never captured as a structured field, meaning contract and intern jobs scored identically to permanent positions despite being much less desirable for most candidates","change":"Added employment_type field (regular/contract/intern/freelance) to all 3 post-processors. Wired into matching algorithm with +5 bonus for preference match, -10 penalty for contract, -15 penalty for intern. 11 new test cases. Updated SKILL.md v3.5, scraper-agent.md, matcher-agent.md v4.4, scraper SKILL.md v5.3.","baseline":{"employment_type_field":false,"employment_tests":0,"total_tests":927},"result":{"employment_type_field":true,"employment_tests":11,"employment_values":"regular/contract/intern/freelance","total_tests":938,"all_passing":true,"regressions":0},"delta":"+11 tests, employment type extracted and matched, 0 regressions","verdict":"keep","improvement_description":"Employment type extraction added to all 3 post-processors (Wanted, JobKorea, LinkedIn) with 4 values: regular (정규직, default), contract (계약직/파견), intern (인턴), freelance (프리랜서). Previously these keywords were stripped during title cleanup with no capture. Matching algorithm now penalizes contract (-10) and intern (-15) jobs when the candidate prefers regular employment, providing meaningful discrimination in the 10% location/work component."}
{"id":"EXP-086","name":"employment-type-dedup-persistence","timestamp":"2026-04-03T14:04:00Z","skill":"job-scraping","metric":"employment_type_pipeline_completeness","hypothesis":"employment_type extracted by all 3 post-processors but never persisted to DB or preserved during dedup merge","change":"Added employment_type TEXT DEFAULT regular column to jobs table. Added to dedup-jobs.js SELECT, fieldScore, enrichFields. Updated scraper-agent.md INSERT template. 12 new validation tests.","baseline":{"employment_type_in_db":false,"employment_type_in_dedup":false,"employment_type_in_insert":false,"total_tests":938},"result":{"employment_type_in_db":true,"employment_type_in_dedup":true,"employment_type_in_insert":true,"total_tests":950,"new_tests":12,"regressions":0},"delta":"+12 tests, employment_type pipeline complete, 0 regressions","verdict":"keep","improvement_description":"Employment type now persists through the full pipeline: extraction → DB storage → dedup preservation. Previously post-processors extracted regular/contract/intern/freelance but the data was lost because (1) no DB column existed, (2) dedup script did not select or enrich the field. Same gap pattern as EXP-077 and EXP-081."}
{"id":"EXP-087","name":"similarity-map-orphaned-skills","timestamp":"2026-04-03T15:30:00Z","skill":"job-matching","metric":"similarity_map_coverage","hypothesis":"47 of 77 skills extracted by skill-inference had zero similarity connections, causing systematic under-scoring for jobs requiring Go, Rust, C#, BigQuery, Snowflake, Airflow, dbt, Unity, Unreal, CI/CD, Linux, SwiftUI, Redux, Laravel, Rails, or Machine Learning","change":"Added 32 new similarity connections across TIER1 (1), TIER2 (15), TIER3 (6). Expanded spark/hadoop with orchestration and cloud DW links. Fixed nuxt alias. Added 15 test assertions.","baseline":{"skills_with_similarity":30,"total_skills":77,"coverage":"39%","similarity_tests":28,"total_tests":950},"result":{"skills_with_similarity":62,"total_skills":77,"coverage":"81%","similarity_tests":43,"total_tests":965,"all_passing":true,"regressions":0},"delta":"+32 connections, +15 tests, coverage 39%→81%, 0 regressions","verdict":"keep","improvement_description":"Similarity map coverage expanded from 39% to 81% of extracted skills. Added connections for systems languages (go↔rust), cloud data warehouses (bigquery↔snowflake), data orchestration (airflow↔dbt), game engines (unity↔unreal), ML ecosystem (machine learning↔tensorflow/pytorch), CI/CD (ci/cd↔jenkins/github actions), and 10 more ecosystem pairs. Jobs requiring these skills now properly match candidates with related competencies instead of scoring 0%."}
{"id":"EXP-088","name":"key-normalization-orphan-connections","timestamp":"2026-04-03T16:04:00Z","skill":"job-matching","metric":"similarity_map_correctness","hypothesis":"rest_api key mismatch in TIER2 broke GraphQL↔REST API similarity for real scraped data; 7 skills had zero connections","change":"Fixed rest_api→rest api key normalization. Fixed duplicate java key (kotlin+jpa merged). Added TIER2/TIER3 connections for devops, aws lambda/s3/sqs, jpa, figma. Updated SKILL.md and matcher-agent.md.","baseline":{"similarity_coverage":"62/77 (81%)","key_bug":"rest_api≠rest api","duplicate_key":"java double entry","total_tests":965},"result":{"similarity_coverage":"77/77 (100%)","key_bug":"fixed","duplicate_key":"fixed","total_tests":"965","regressions":0},"delta":"100% coverage, 2 bugs fixed, 0 regressions","verdict":"keep","improvement_description":"Two bugs fixed and remaining orphans connected. Key normalization bug meant GraphQL↔REST API similarity never matched real scraped data (rest_api in TIER2 vs rest api from skill-inference). Duplicate JS object key silently broke Java↔Kotlin connection. All 77 skills now have at least one similarity connection."}
{"id":"EXP-089","name":"resume-agent-skill-inference-sync","timestamp":"2026-04-03T17:04:00Z","skill":"resume-agent","metric":"skill_coverage_parity","hypothesis":"resume-agent.md had 39 skills while skill-inference.js had 77 — 38 skills (Kafka, BigQuery, Figma, Linux, Airflow, dbt, Unity, etc.) were invisible to resume parsing, creating a pipeline gap where matching couldn't use candidate skills that weren't extracted","change":"Replaced 4 inline skill maps (languageMap, frameworkMap, dbMap, infraMap) in resume-agent.md with reference to scripts/skill-inference.js as single source of truth. Updated primary domain detection table with expanded skill lists. All 77 skills now available for resume extraction.","baseline":{"resume_agent_skills":39,"skill_inference_skills":77,"gap":38,"coverage":"51%"},"result":{"resume_agent_skills":77,"skill_inference_skills":77,"gap":0,"coverage":"100%","total_tests":"965","regressions":0},"delta":"38 skills added, 0 regressions, resume-agent now at full skill coverage parity","verdict":"keep","improvement_description":"Resume agent skill extraction now uses the same 77-skill vocabulary as job matching. Previously 38 skills including Kafka, BigQuery, Figma, Linux, Airflow, dbt, Unity, Unreal, CI/CD, DevOps, React Native, Flutter, Spring Boot, Laravel, Rails, and all AWS services were invisible to resume parsing. A candidate listing these skills would have them silently dropped from the matching pipeline. Now resume-agent references scripts/skill-inference.js as the single source of truth, eliminating future drift between resume extraction and job matching skill vocabularies."}
{"id":"EXP-090","name":"resume-nlp-skill-inference-sync","timestamp":"2026-04-03T18:04:00Z","skill":"resume-agent","metric":"skill_extraction_sync","hypothesis":"test_resume_nlp.js had 39-skill inline maps while resume-agent.md references skill-inference.js (77 skills) — test was validating stale extraction logic","change":"Replaced inline maps in test with import from skill-inference.js. Added 32 new test cases for all 38 previously-untested skills. Fixed 7 missing Korean equivalents in skill-inference.js (젠킨스, 포스트그레스, 레디스, 몽고디비, 일래스틱, S3 standalone, SQS with Korean context).","baseline":{"resume_nlp_tests":"44","skill_source":"inline maps (39 skills)","korean_equivalents_gaps":7,"total_tests":"965"},"result":{"resume_nlp_tests":"76","skill_source":"skill-inference.js (77 skills)","korean_equivalents_fixed":7,"total_tests":"997","all_passing":true,"regressions":0},"delta":"+32 tests, 7 Korean regex fixes, single source of truth, 0 regressions","verdict":"keep","improvement_description":"Resume NLP test suite synced with skill-inference.js as single source of truth. Previously tested 39 skills via inline maps that drifted from the actual 77-skill module. Now validates all 77 skills including Korean equivalents. Found and fixed 7 missing Korean patterns: 젠킨스 (jenkins), 포스트그레스 (postgresql), 레디스 (redis), 몽고디비 (mongodb), 일래스틱 (elasticsearch), plus S3 and SQS patterns that only matched with 'AWS' prefix."}
