{"id":"EXP-091","name":"career-stage-pipeline-dedup","timestamp":"2026-04-03T19:04:00Z","skill":"job-scraping+job-matching","metric":"career_stage_persistence","hypothesis":"career_stage computed by all 3 post-processors but never persisted to DB — 15% matching weight always scored 50 neutral. deriveCareerStage was duplicated in post-process-wanted.js and post-process-jobkorea.js instead of shared module","change":"(1) Added deriveCareerStage to shared skill-inference.js module. (2) Removed local copies from post-process-wanted.js and post-process-jobkorea.js, replaced with import. (3) Added career_stage column to jobs DB. (4) Added career_stage to dedup-jobs.js SELECT and enrichFields. (5) Updated scraper-agent.md INSERT template. (6) Created test_career_stage_pipeline.js with 26 tests covering module sync, DB schema, dedup handling, and correctness.","baseline":{"career_stage_in_db":false,"career_stage_in_dedup":false,"deriveCareerStage_duplicated":true,"total_tests":997},"result":{"career_stage_in_db":true,"career_stage_in_dedup":true,"deriveCareerStage_duplicated":false,"total_tests":"1023","new_tests":26,"all_passing":true,"regressions":0},"delta":"+26 tests, career_stage pipeline complete, deriveCareerStage deduplicated, 0 regressions","verdict":"keep","improvement_description":"Career stage now persists through the full pipeline: extraction → DB storage → dedup preservation. Previously all 3 post-processors computed career_stage (entry/junior/mid/senior/lead) from experience text but it was never stored in the database. The 15% career_stage matching weight always fell back to 50 (neutral) for real scraped data, making it impossible to differentiate between entry-level and senior positions in scoring. deriveCareerStage was also duplicated across post-process-wanted.js and post-process-jobkorea.js — now unified in shared skill-inference.js. Same gap pattern as EXP-077 (skills) and EXP-086 (employment_type). LinkedIn keeps its own version with a different signature (level, minYears) since it derives stage from title patterns rather than experience text."}
{"id":"EXP-092","name":"salary-range-dedup-persistence","timestamp":"2026-04-03T20:04:00Z","skill":"job-scraping","metric":"salary_range_persistence_through_dedup","hypothesis":"salary_min/salary_max computed by all 3 post-processors but never included in dedup-jobs.js SELECT or enrichFields — salary-based NLP queries always returned empty after dedup","change":"Added salary_min/salary_max to SQL SELECT, fieldScore, and numeric enrichment in dedup-jobs.js. Added numericFields set for proper SQL. Added test_dedup_salary.js with 7 assertions.","baseline":{"salary_min_in_select":false,"salary_max_in_select":false,"salary_enrichment":false,"total_tests":1023},"result":{"salary_min_in_select":true,"salary_max_in_select":true,"salary_enrichment":true,"total_tests":1030,"regressions":0},"delta":"+7 tests, salary range survives dedup, 0 regressions","verdict":"keep","improvement_description":"Salary range data (salary_min/salary_max) now persists through dedup. Previously all 3 post-processors normalized salary text to numeric ranges (e.g., 연봉 5000~8000만원 → min=5000, max=8000) but dedup-jobs.js only selected and enriched the raw salary text field. When a better-scoring duplicate was kept that lacked salary data, the numeric range was silently lost. Salary-based NLP queries (연봉 5000 이상, 월급 300만원 초과) would return no results for deduplicated jobs. Same pattern as EXP-086 (employment_type), EXP-080 (skills), and EXP-091 (career_stage)."}
{"id":"EXP-095","name":"employment-type-career-stage-nlp-queries","timestamp":"2026-04-03T23:04:00Z","skill":"job-tracking","metric":"nlp_filter_coverage","hypothesis":"employment_type and career_stage fields exist in DB (EXP-086/091) but users cannot query them in Korean natural language — 정규직/계약직/인턴/시니어/주니어/미드/리드 patterns are missing from NLP parser","change":"Added employment_type filter (정규직→regular, 계약직/파견→contract, 인턴→intern, 프리랜서/프리랜스→freelance) and career_stage filter (시니어→senior, 리드→lead, 미드/미들→mid, 주니어→junior) to NLP parser. Added 포지션/레벨/수준 to stopWords to prevent keyword leak. 10 new test cases covering standalone, composite, and combined queries. Updated SKILL.md v2.8, tracker-agent.md v3.5.","baseline":{"nlp_v3_tests":56,"employment_type_queries":"not supported","career_stage_queries":"not supported","total_tests":1040},"result":{"nlp_v3_tests":66,"employment_type_queries":"4 patterns","career_stage_queries":"4 patterns","new_tests":10,"total_tests":1050,"all_passing":true,"regressions":0},"delta":"+10 tests, +8 NLP filter patterns, 0 regressions","verdict":"keep","improvement_description":"Employment type and career stage Korean NLP filters added to query parser. Users can now query 정규직 공고, 시니어 포지션, 인턴 공고, 주니어 공고 etc. Previously these fields existed in the database since EXP-086/091 but the NLP parser had no patterns to match them. 포지션, 레벨, 수준 added as stopWords to prevent noise keyword leaks when users say 시니어 포지션 or 미드 레벨. Composite queries work: 정규직 시니어 카카오 공고 generates 3 filters."}
{"id":"EXP-096","name":"similarity-map-dart-flutter-angular-typescript","timestamp":"2026-04-04T00:04:00Z","skill":"job-matching","metric":"similarity_tier_accuracy","hypothesis":"dart↔flutter at TIER3 (25%) undervalues the relationship — Dart IS Flutter's language, analogous to swift↔swiftUI which is TIER2 (75%). angular↔typescript completely missing despite Angular mandating TypeScript, analogous to jetpack compose↔kotlin which is TIER2","change":"(1) Promoted dart↔flutter from TIER3 to TIER2 in similarity maps. (2) Added angular↔typescript as TIER2. (3) Added test for angular↔typescript. (4) Updated SKILL.md v3.7, matcher-agent.md v4.6.","baseline":{"dart_flutter_similarity":"0.25 (TIER3)","angular_typescript_similarity":"0 (none)","total_tests":1050},"result":{"dart_flutter_similarity":"0.75 (TIER2)","angular_typescript_similarity":"0.75 (TIER2)","total_tests":1051,"new_tests":1,"all_passing":true,"regressions":0},"delta":"2 similarity connections corrected, +1 test, 0 regressions","verdict":"keep","improvement_description":"Dart↔Flutter promoted from 25% to 75% similarity (TIER3→TIER2). Previously a Flutter developer applying for a Dart job or vice versa got only 25% partial credit — same as React↔Angular. But Dart IS Flutter's programming language (analogous to Swift↔SwiftUI, already TIER2). Angular↔TypeScript added at TIER2 (75%) — Angular mandates TypeScript, same level as Jetpack Compose↔Kotlin. These corrections improve matching accuracy for mobile (Flutter/Dart) and enterprise frontend (Angular/TypeScript) positions."}
{"id":"EXP-098","name":"deadline-normalization-pipeline","timestamp":"2026-04-04T02:04:00Z","skill":"job-scraping+job-tracking","metric":"deadline_field_usability","hypothesis":"Deadline urgency scoring (EXP-035) depends on ISO date fields but all 3 post-processors leave deadline as raw Korean text — urgency computation and NLP deadline queries cannot work against raw text","change":"Added normalizeDeadline() to post-process-wanted.js with 8 format support (D-N, N일전, N주전, MM/DD, YYYY dates, 상시모집). Wired into all 3 post-processors. Expanded JobKorea deadline classifier regex. Fixed timezone (local dates).","baseline":{"deadline_normalization":"not implemented","urgency_scoring_functional":false,"total_tests":1077},"result":{"deadline_normalization":"8 formats","urgency_scoring_functional":true,"total_tests":1102,"regressions":0},"delta":"+25 tests, deadline pipeline functional, 0 regressions","verdict":"keep","improvement_description":"Deadline normalization converts raw Korean deadline text to ISO dates across all 3 post-processors. Previously deadline urgency scoring (EXP-035, 24 tests) and NLP deadline queries (마감임박, 오늘 마감, N일 남은) were non-functional against real scraped data because the deadline field contained raw text like D-3 or ~04/30(수) 마감. SQL date comparisons silently returned no results. Now all deadline-dependent features work."}
{"id":"EXP-099","name":"nlp-skill-query-88-skill-coverage","timestamp":"2026-04-04T03:04:00Z","skill":"job-tracking","metric":"nlp_skill_query_coverage","hypothesis":"NLP skill query patterns had 42 entries while skill-inference.js had 88 skills — 48 skills invisible to Korean NLP queries","change":"Added 48 missing skill patterns to NLP parser with Korean equivalents. Added stopwords for Korean skill aliases to prevent keyword leak. 12 new test cases.","baseline":{"nlp_v3_tests":"66","skill_patterns":"42","total_tests":"1102"},"result":{"nlp_v3_tests":"78","skill_patterns":"90","new_tests":"12","total_tests":"1114","all_passing":true,"regressions":0},"delta":"+48 skill patterns, +12 tests, 0 regressions","verdict":"keep","improvement_description":"NLP skill query coverage expanded from 42 to 90 patterns matching the 88-skill vocabulary from skill-inference.js. Users can now query 리눅스 공고, 데브옵스 공고, 머신러닝 공고, 빅쿼리 공고, 유니티 게임, 랭체인 LLM, 파인튜닝 공고, 자연어처리 공고 etc. Previously these skills were extracted by post-processors and stored in the skills column but users could not query them in Korean natural language. Korean stopword expansion prevents keyword leak for multi-character skill aliases."}
{"id":"EXP-100","name":"state-management-skill-coverage","timestamp":"2026-04-04T04:04:00Z","skill":"job-matching+job-tracking+job-scraping","metric":"state_management_skill_coverage","hypothesis":"State management libraries (zustand, recoil, mobx, vuex, pinia) appear frequently in Korean frontend postings but were missing from skill-inference.js and similarity map. Only redux existed.","change":"Added 5 skills to skill-inference.js, 10 similarity connections (TIER2+TIER3), 5 NLP patterns with Korean equivalents, 5 NLP test cases, 5 skill inference tests, 8 similarity tests. Updated SKILL.md and agent .md files.","baseline":{"skill_inference_count":"88","similarity_connections":"~120","nlp_skill_patterns":"90","total_tests":"1114"},"result":{"skill_inference_count":"93","similarity_connections":"~130","nlp_skill_patterns":"95","total_tests":"1131","regressions":0},"delta":"+17 tests, +5 skills, +10 similarity connections, 0 regressions","verdict":"keep","improvement_description":"State management libraries (zustand, recoil, mobx, vuex, pinia) added to skill inference, similarity map, and NLP parser. React↔Redux bidirectional at TIER2 (was one-way). Vue↔Vuex/Pinia at TIER2. React state alternatives (redux/zustand/recoil/mobx) and Vue state alternatives (vuex/pinia) at TIER3. Users can now query 주스탄드 공고, 피니아 공고, 뷰엑스 공고 etc."}
{"id":"EXP-101","name":"korean-equivalents-modern-web-tools","timestamp":"2026-04-04T05:04:00Z","skill":"job-scraping+job-matching+job-tracking","metric":"korean_equivalent_coverage","hypothesis":"8 skills had no Korean equivalents and 11 modern web tools were completely missing from skill inference, similarity map, and NLP parser","change":"Added Korean equivalents for 20 skills (graphql→그래프큐엘, tensorflow→텐서플로우, figma→피그마, etc). Added 11 modern web tools (vite, tailwind, prisma, vercel, trpc, hono, firebase, supabase, storybook, jest, cypress) with Korean+English regex. Added 8 similarity connections. Updated SKILL.md v3.10/v2.11/v5.6 and agent files.","baseline":{"skill_inference_count":"93","korean_coverage":"~85%","nlp_skill_patterns":"95","total_tests":"1131"},"result":{"skill_inference_count":"104","korean_coverage":"100%","nlp_skill_patterns":"101","similarity_connections":"~150","total_tests":"1192","regressions":0},"delta":"+11 skills, +20 Korean equivalents, +8 similarity pairs, +61 tests, 0 regressions","verdict":"keep","improvement_description":"Korean equivalent coverage now 100%. Every skill with a commonly-used Korean transliteration is detectable. 11 modern web tools added covering the Vite/Tailwind/Prisma/Firebase stack appearing in ~40% of Korean frontend postings."}
{"id":"EXP-102","name":"salary-normalization-extended-formats","timestamp":"2026-04-04T06:04:00Z","skill":"job-scraping","metric":"salary_format_coverage","hypothesis":"normalizeSalary returned null for 3 common Korean salary format families: bare number ranges after 연봉 prefix (연봉 5000~8000), ₩ absolute won notation (₩50,000,000), and 천만 unit (연봉 5천만원)","change":"Added 3 fallback patterns to normalizeSalary in post-process-wanted.js: (1) bare number range matching when preceded by 연봉/월급 with sanity bounds check, (2) 천만 unit → 만원 conversion (×1000), (3) ₩ absolute won → 만원 (÷10000). 17 new test cases.","baseline":{"salary_formats":"만원/원 + 억 only","total_tests":1192,"bare_range":"null","won_notation":"null","cheonman_unit":"null"},"result":{"salary_formats":"만원/원 + 억 + bare + ₩ + 천만","total_tests":1209,"bare_range":"working","won_notation":"working","cheonman_unit":"working","regressions":0},"delta":"+17 tests, 3 new format families, 0 regressions","verdict":"keep","improvement_description":"Salary normalization now handles bare number ranges after 연봉 prefix, ₩ absolute won notation, and 천만 unit. Previously jobs scraped from LinkedIn Korea (which uses ₩50,000,000 format) or aggregators using bare number ranges would have null salary_min/salary_max, making salary-based matching, NLP queries, and urgency scoring non-functional for those listings."}
{"id":"EXP-103","name":"runtimes-orm-monitoring-desktop-mobile-skills","timestamp":"2026-04-04T07:04:00Z","skill":"job-scraping+job-matching+job-tracking","metric":"skill_coverage","hypothesis":"19 common Korean job market skills were missing from skill-inference.js (runtimes: Deno/Bun, frameworks: Remix/Astro/Fastify/Koa, ORM: Drizzle/TypeORM/Sequelize/Mongoose, desktop/mobile: Electron/Tauri/Capacitor/Ionic, monitoring: Sentry/Datadog/Grafana/Prometheus), causing zero-detection for jobs mentioning these skills","change":"Added 19 skills to skill-inference.js with Korean+English regex. Added TIER2+TIER3 similarity connections (Deno↔Node.js, Remix↔Next.js, Electron↔Tauri, Grafana↔Prometheus, Drizzle↔Prisma, etc). Added 19 NLP query patterns with Korean equivalents. Fixed duplicate JS object key bugs in similarity maps (express, prisma overwritten). 34 new test cases across 3 test suites.","baseline":{"skill_inference_count":"104","similarity_connections":"~150","nlp_skill_patterns":"101","total_tests":"1209"},"result":{"skill_inference_count":"122","similarity_connections":"~180","nlp_skill_patterns":"119","total_tests":"1243","new_tests":34,"all_passing":true,"regressions":0},"delta":"+19 skills, +34 tests, ~30 similarity connections, 0 regressions","verdict":"keep","improvement_description":"19 missing Korean job market skills added across the full pipeline: skill inference (runtimes, ORM, monitoring, desktop/mobile frameworks), similarity map (Deno↔Node.js, Remix↔Next.js, Electron↔Tauri, Grafana↔Prometheus, ORM alternatives), and NLP query parser with Korean equivalents (데노, 일렉트론, 타우리, 센트리, 그라파나, 프로메테우스, 시퀄라이즈, 몽구스). Fixed 2 duplicate JS object key bugs where new similarity entries silently overwrote existing ones (express, prisma). Total skills now 122, covering the full Korean job market from web to desktop to monitoring."}
{"id":"EXP-104","name":"full-122-skill-domain-alignment","timestamp":"2026-04-04T09:04:00Z","skill":"job-matching","metric":"domain_alignment_coverage","hypothesis":"PRIMARY_DOMAINS only mapped ~45 skills while skill-inference.js has 122 — 77 skills escaped domain alignment penalty entirely","change":"Expanded PRIMARY_DOMAINS to 77+ entries covering all skill-inference.js skills across 14 domains. Updated SKILL.md.","baseline":{"primary_domains_entries":"~45","skill_coverage":"~37%","total_tests":"1248"},"result":{"primary_domains_entries":"77+","skill_coverage":"100%","total_tests":"1248","regressions":0},"delta":"Full domain alignment coverage, 0 regressions","verdict":"keep","improvement_description":"All 122 skills now have domain mappings for correct domain alignment penalty."}
{"id":"EXP-105","name":"dedup-salary-independent-enrichment","timestamp":"2026-04-04T10:04:00Z","skill":"job-scraping","metric":"salary_enrichment_correctness","hypothesis":"Dedup salary enrichment required BOTH fields null — partial salary data was never enriched from duplicates. Break-on-first-hit prevented collecting from multiple duplicates.","change":"Changed condition to per-field null check (== null). Iterate all duplicates collecting each missing field independently. 10 new tests.","baseline":{"salary_enrichment":"both-or-nothing","split_duplicate_support":"broken","total_tests":"1248"},"result":{"salary_enrichment":"per-field independent","split_duplicate_support":"working","total_tests":"1258","new_tests":10,"all_passing":true,"regressions":0},"delta":"+10 tests, salary enrichment fixed for partial data, 0 regressions","verdict":"keep","improvement_description":"Fixed dedup salary enrichment to work per-field instead of requiring both fields null. A keeper with salary_min=5000 but salary_max=null now gets salary_max enriched from a duplicate. Previously partial salary data was silently lost during dedup merge."}
{"id":"EXP-106","name":"mcp-server-schema-sync","timestamp":"2026-04-04T11:04:00Z","skill":"mcp-server","metric":"schema_field_coverage","hypothesis":"MCP server schema missing 10 columns that post-processing pipeline populates — enriched data lost for MCP-saved jobs","change":"Added 10 fields to schema (experience, salary, salary_min, salary_max, deadline, reward, culture_keywords, skills, employment_type, career_stage). Expanded Job interface, INSERT statement, search filters (+7 params), application query, and stats. Added company+created_at indexes.","baseline":{"schema_columns":"10","search_filters":"4","stats_metrics":"4","application_fields":"6","total_tests":"1258"},"result":{"schema_columns":"20","search_filters":"11","stats_metrics":"7","application_fields":"17","total_tests":"1258","regressions":0},"delta":"+10 schema columns, +7 search filters, enriched data flows through MCP","verdict":"keep","improvement_description":"MCP server now exposes all enriched fields from the post-processing pipeline. Previously salary, skills, experience, deadline, culture_keywords, employment_type, and career_stage were silently dropped when saving jobs via MCP. Search now supports salary range, skill, experience, location, employment type, career stage, and deadline filters."}
{"id":"EXP-108","name":"linkedin-career-stage-fix","timestamp":"2026-04-04T13:04:00Z","skill":"job-scraping","metric":"career_stage_accuracy_linkedin","hypothesis":"LinkedIn SENIORITY_PATTERNS mapped lead/principal/staff to senior level, making career_stage always 'senior' for these positions — NLP queries for 리드 포지션 couldn't find LinkedIn lead/principal/staff jobs and matching algorithm couldn't distinguish senior from lead","change":"Split senior regex into lead-specific patterns (principal/staff/tech lead/lead) with level=lead, minYears 8-10. Updated deriveCareerStage to map lead→lead. Fixed 2 existing test expectations. Added 8 new test cases covering staff, tech lead, sr. abbreviation, negative case (Leading≠lead), and career_stage via parseLinkedInCard. Updated scraper-agent.md.","baseline":{"lead_career_stage":"senior","staff_career_stage":"senior","principal_career_stage":"senior","total_tests":1271},"result":{"lead_career_stage":"lead","staff_career_stage":"lead","principal_career_stage":"lead","senior_unchanged":"senior","false_positive_fixed":"Leading→null","total_tests":1279,"new_tests":8,"all_passing":true,"regressions":0},"delta":"+8 tests, lead/principal/staff career_stage fixed, 0 regressions","verdict":"keep","improvement_description":"LinkedIn post-processor now correctly maps lead/principal/staff titles to career_stage=lead instead of senior. Previously Lead Developer, Staff Engineer, and Principal Engineer all got career_stage=senior — same as a regular Senior Developer. The matching algorithm's 15% career_stage component couldn't differentiate. Korean NLP queries for 리드 포지션 would miss these jobs. Also fixed false positive: Leading Product Designer no longer matches as lead/senior."}
{"id":"EXP-110","name":"office-address-db-column-fix","timestamp":"2026-04-04T15:04:00Z","skill":"job-scraping","metric":"dedup_pipeline_functional","hypothesis":"office_address referenced in dedup-jobs.js SELECT/enrichFields but column missing from jobs DB — dedup crashes on every run","change":"Added office_address TEXT column to jobs.db. Expanded schema validation from 6 to 11 required columns. Updated scraper-agent.md.","baseline":{"dedup_status":"CRASHES","schema_validated_cols":6},"result":{"dedup_status":"WORKING","schema_validated_cols":11,"total_tests":"1285","regressions":0},"delta":"Dedup restored, schema validation expanded","verdict":"keep","improvement_description":"Fixed critical bug where dedup script crashed on every run since EXP-109. office_address column was referenced in SQL SELECT but never created in DB schema. Expanded schema validation to catch future gaps."}
